displayUserNick,auctionSku,rateDate,rateContent
k***g,颜色:54 绿色;尺码:180/108B/XL,2021-03-03 12:36:39,质量没得说，跟专卖店一样，特别特别喜欢，而且价格优惠
k***g,颜色:54 绿色;尺码:165/84A/S,2021-03-03 12:36:39,质量很好哦，发货也很快，一家非常喜欢的店铺，我要疯狂推荐给朋友们
h***贤,颜色:59 墨绿色;尺码:180/108B/XL,2021-03-03 08:59:41,🉑️
雯***5,颜色:08 深灰色;尺码:175/100A/L,2021-02-25 13:39:17,颜色质量跟实体店一模一样
未***1,颜色:36 褐色;尺码:175/100A/L,2021-02-21 19:31:37,男士的同款外套不如女士的折扣多，适合年轻时尚青年。内搭的话就无所谓了。尺码偏大178  75kg 穿L正好
g***h,颜色:54 绿色;尺码:180/108B/XL,2021-02-18 10:26:06,真的很暖和 可惜南方的天气已经热起来了
s***m,颜色:54 绿色;尺码:175/100A/L,2021-02-17 22:34:31,摸着很舒服 穿着也很好看
小***i,颜色:08 深灰色;尺码:175/100A/L,2021-02-12 12:45:35,店里没号了，网上一样买
忆***7,颜色:08 深灰色;尺码:175/100A/L,2021-02-11 22:52:25,还不错滴
1***子,颜色:36 褐色;尺码:175/100A/L,2021-02-11 20:35:22,大小合适，颜色也不错，老人很满意
1***子,颜色:08 深灰色;尺码:175/100A/L,2021-02-11 20:35:22,大小合适，颜色也不错，老人很喜欢
b***1,颜色:46 鹅黄色;尺码:165/84A/S,2021-02-11 01:03:02,无 无 好 很好
w***8,颜色:08 深灰色;尺码:175/100A/L,2021-02-10 18:04:41,各方面都好，就是开车安全带容易嘞出印子。
牛***死,颜色:08 深灰色;尺码:175/100A/L,2021-02-08 23:30:44,不错
w***8,颜色:31 米色;尺码:175/100A/L,2021-02-08 09:20:43,衣服质量好，穿着舒服。
s***0,颜色:31 米色;尺码:180/108B/XL,2021-02-07 20:02:05,很暖
l***t,颜色:54 绿色;尺码:180/108B/XL,2021-02-05 12:16:56,此用户没有填写评论!
默***1,颜色:08 深灰色;尺码:175/100A/L,2021-02-04 15:41:11,质量一般，感觉一般。
r***9,颜色:08 深灰色;尺码:175/100A/L,2021-02-04 15:05:09,明明表的是男装 号儿却是女装的号儿 买的三件都特别小
星***6,颜色:36 褐色;尺码:170/92A/M,2021-02-03 06:07:07,199元有点小贵，䄂子太宽了，面料不值这个价钱
z***5,颜色:36 褐色;尺码:170/92A/M,2021-02-02 18:54:38,送给老人家的。应该还行。
彩***里,颜色:36 褐色;尺码:175/100A/L,2021-02-02 13:25:20,买给父亲的，他很喜欢。好评！
l***f,颜色:54 绿色;尺码:175/100A/L,2021-02-01 23:39:37,给家里老人买的，穿起来轻快保暖，老人很舒服
t***7,颜色:08 深灰色;尺码:180/108B/XL,2021-02-01 18:01:04,还不错吧
s***y,颜色:08 深灰色;尺码:175/100A/L,2021-02-01 09:32:53,不错
t***6,颜色:36 褐色;尺码:175/100A/L,2021-01-31 14:59:57,质量很好
w***9,颜色:63 天蓝色;尺码:180/108B/XL,2021-01-31 14:53:54,好，很好。
6***g,颜色:08 深灰色;尺码:180/108B/XL,2021-01-29 20:32:49,颜色很正，弟弟喜欢身高183体重140，简单保暖不俗气！一个➕
小***喂,颜色:17 枣红色;尺码:165/84A/S,2021-01-27 15:14:02,给姥姥买的本命年外套，长度合适，保暖轻快～姥姥爱不释手～超级棒！
斯***弟,颜色:08 深灰色;尺码:175/100A/L,2021-01-26 09:27:17,舒服
c***8,颜色:54 绿色;尺码:170/92A/M,2021-01-23 11:50:50,巨巨巨巨显胖&hellip;&hellip;穿不出去，放办公室穿了
海***0,颜色:54 绿色;尺码:185/112C/XXL,2021-01-23 10:14:22,抱歉收货晚啦！衣服很好
野***咪,颜色:54 绿色;尺码:170/92A/M,2021-01-23 09:39:07,不错，再次回购，保暖好，居家必备。
c***0,颜色:08 深灰色;尺码:175/100A/L,2021-01-23 07:33:02,给老人买的大家都很喜欢！很实用
c***0,颜色:77 灰紫色;尺码:170/92A/M,2021-01-23 07:33:02,给老人买的大家都很喜欢！
诺***4,颜色:54 绿色;尺码:175/100A/L,2021-01-22 20:33:06,衣服很不错！
k***y,颜色:08 深灰色;尺码:175/100A/L,2021-01-22 17:02:12,感觉男装比女装更厚实
o***圈,颜色:36 褐色;尺码:185/112C/XXL,2021-01-21 21:06:13,给老爸老妈买的，他俩说很轻很暖和，非常喜欢
琉***4,颜色:08 深灰色;尺码:170/92A/M,2021-01-21 17:19:54,还不错，毛茸茸的很舒服，还挺保暖的
何***文,颜色:54 绿色;尺码:165/84A/S,2021-01-21 16:46:36,此用户没有填写评论!
兜***伊,颜色:08 深灰色;尺码:170/92A/M,2021-01-20 19:41:44,之前买了一件很暖和，实体店已没有了，这里再购一件，质量挺好的！
a***者,颜色:08 深灰色;尺码:170/92A/M,2021-01-20 16:38:03,非常舒服
w***1,颜色:08 深灰色;尺码:165/84A/S,2021-01-20 15:49:24,尺码推荐：165-168 s码 整体评价：舒服保暖 上身效果：不错 厚薄度：稍厚，长条绒 面料品质：软！
v***9,颜色:08 深灰色;尺码:170/92A/M,2021-01-20 15:20:23,💌收到立马打开看了一下，非常不错，质量超好，颜值又高😘，推荐推荐🉑
l***6,颜色:36 褐色;尺码:180/108B/XL,2021-01-20 14:16:37,不错
r***洛,颜色:36 褐色;尺码:165/84A/S,2021-01-20 11:41:08,很轻但超级保暖毛茸茸太可爱啦穿上就是可爱抱抱熊
b***珀,颜色:08 深灰色;尺码:175/100A/L,2021-01-20 09:49:46,此用户没有填写评论!
安***落,颜色:08 深灰色;尺码:175/100A/L,2021-01-20 09:46:51,柔软 不掉毛。
z***3,颜色:77 灰紫色;尺码:180/108B/XL,2021-01-19 18:10:26,高179 重157  L.XL都可以穿。家里穿必备，很柔软舒服。
z***2,颜色:54 绿色;尺码:185/128C/XXXXL,2021-01-19 16:24:33,凑合挺暖和的
i***e,颜色:54 绿色;尺码:160/76A/XS,2021-01-19 14:00:55,此用户没有填写评论!
宜***本,颜色:08 深灰色;尺码:180/108B/XL,2021-01-19 12:27:31,回购  好评
酷***棒,颜色:67 海蓝色;尺码:165/84A/S,2021-01-19 09:36:36,此用户没有填写评论!
s***3,颜色:31 米色;尺码:170/92A/M,2021-01-18 21:22:42,很暖和，不知道洗了怎么样
m***1,颜色:08 深灰色;尺码:175/100A/L,2021-01-18 14:47:38,很好
李***妖,颜色:59 墨绿色;尺码:180/108B/XL,2021-01-18 11:05:38,衣服很软很舒服，就是这价格调的是真快，还不返差价
吴***2,颜色:77 灰紫色;尺码:180/108B/XL,2021-01-18 09:51:53,爱结陀，能不能质量在上一层啊，双十一买的一件就已经成旧旧衣服了
淡***草,颜色:67 海蓝色;尺码:180/108B/XL,2021-01-18 09:33:11,整体评价：挺好的暖和 材质特性：毛绒绒 上身效果：还不错 尺码推荐：175，150，xl有点肥 厚薄度：北方初冬穿合适 面料品质：质量好
t***8,颜色:77 灰紫色;尺码:180/108B/XL,2021-01-17 21:07:25,穿了很舒服。正品
宜***本,颜色:31 米色;尺码:180/108B/XL,2021-01-17 20:47:45,孩子住校   学校没放假   一直没回来   衣服没试   先给好评
托***尔,颜色:36 褐色;尺码:185/120C/XXXL,2021-01-17 12:36:28,好看，好穿
燕***虾,颜色:37 栗色;尺码:175/100A/L,2021-01-16 23:14:45,可以
q***6,颜色:67 海蓝色;尺码:165/84A/S,2021-01-16 22:32:38,挺暖和的
j***2,颜色:54 绿色;尺码:170/92A/M,2021-01-16 20:30:03,给婆婆买的，很暖和
y***3,颜色:08 深灰色;尺码:165/84A/S,2021-01-16 20:18:48,衣服穿上很暖，很舒服，说明书注会掉毛，那就很难看物流很快。
宋***7,颜色:77 灰紫色;尺码:175/100A/L,2021-01-16 15:20:28,优衣库的服务真差劲 店大欺客。刚穿了两天袖口起球，弄都弄不开。很差劲。色差严重。
m***y,颜色:08 深灰色;尺码:175/100A/L,2021-01-16 11:02:12,不错
乐***5,颜色:08 深灰色;尺码:175/100A/L,2021-01-15 22:03:37,合适
t***2,颜色:08 深灰色;尺码:165/84A/S,2021-01-15 21:33:03,还不错，运费有点坑
陈***9,颜色:67 海蓝色;尺码:170/92A/M,2021-01-15 17:05:22,颜色好看，手感很好
a***f,颜色:08 深灰色;尺码:175/100A/L,2021-01-15 17:04:03,非常暖和 整体评价：不错 材质特性：摇粒绒 上身效果：可以 尺码推荐：标准 厚薄度：暖和 面料品质：赞
福***8,颜色:08 深灰色;尺码:175/100A/L,2021-01-15 16:10:33,特别喜欢
福***8,颜色:77 灰紫色;尺码:170/92A/M,2021-01-15 16:10:33,非常好👍暧和
嗷***贪,颜色:36 褐色;尺码:185/120C/XXXL,2021-01-15 11:21:21,给爸爸弟弟都买了，爸爸开始还说不要，买回来穿着都不脱了哈哈哈哈哈哈哈哈哈
嗷***贪,颜色:31 米色;尺码:180/108B/XL,2021-01-15 11:21:21,给爸爸弟弟都买了，爸爸开始还说不要，买回来穿着都不脱了哈哈哈哈哈哈哈哈哈
钱***7,颜色:36 褐色;尺码:175/100A/L,2021-01-15 09:44:30,好
s***2,颜色:31 米色;尺码:175/100A/L,2021-01-14 22:10:33,可以
悠***2,颜色:77 灰紫色;尺码:175/100A/L,2021-01-14 19:11:09,妈妈喜欢，暖和
c***i,颜色:31 米色;尺码:175/100A/L,2021-01-14 18:34:16,一如既往
q***a,颜色:08 深灰色;尺码:170/92A/M,2021-01-14 12:54:08,衣服有人穿过有头发和香水
h***2,颜色:08 深灰色;尺码:175/100A/L,2021-01-14 10:36:55,没啥毛病，优衣库全身上下都是
h***2,颜色:08 深灰色;尺码:175/100A/L,2021-01-14 10:04:20,很保暖，买来送人，不错
洪***b,颜色:54 绿色;尺码:185/112C/XXL,2021-01-14 08:17:23,很暖和！！！穿上立马就暖了
z***6,颜色:08 深灰色;尺码:170/92A/M,2021-01-13 20:06:14,非常柔软，穿着很舒服🌺，衣服质量很好很保暖，和棉服一样暖和👻，不用再买羽绒服了手感一级棒！一🎅年下来囤很多优衣库系列，穿上男票的衣服颜色🚄，暖暖的，毛料软软的，穿起来太帅了，怎么说呢，价格不错💡，衣服质感很好。
老***亮,颜色:59 墨绿色;尺码:175/100A/L,2021-01-13 17:38:26,柔软厚实，上身很舒服，老公好喜欢。
d***3,颜色:54 绿色;尺码:165/84A/S,2021-01-13 17:34:33,柔软舒适不掉毛 怎么穿怎么舒服
j***2,颜色:08 深灰色;尺码:180/108B/XL,2021-01-13 17:06:48,手感：非常舒服，爱不释手那个级别的。 保暖：一百分无敌了 优衣库yyds
t***8,颜色:08 深灰色;尺码:175/100A/L,2021-01-13 15:22:59,还可以
中***胜,颜色:36 褐色;尺码:165/84A/S,2021-01-13 09:34:54,已经用过一段时间了，效果不错😍，客服服务有耐心，解答详细，赞一个
o***纯,颜色:77 灰紫色;尺码:180/108B/XL,2021-01-12 22:04:03,收到货后试了一下，很不错，质量很好，值得拥有！五星好评！
o***纯,颜色:77 灰紫色;尺码:175/100A/L,2021-01-12 22:04:03,以前一直都是在实体店买，这次选择了网上买，不光是正品，价格还实惠！
徐***7,颜色:08 深灰色;尺码:175/100A/L,2021-01-12 20:07:39,面料品质：穿一会就发现好多个地方的毛全部粘粘在一起 找售后一直都没人来解决 每次都是发一大堆广告
t***3,颜色:08 深灰色;尺码:165/84A/S,2021-01-12 18:53:54,好
w***6,颜色:46 鹅黄色;尺码:165/84A/S,2021-01-12 15:32:32,版型合体，面料柔和，上身保暖，价格实惠！
茜***2,颜色:77 灰紫色;尺码:180/108B/XL,2021-01-12 14:55:08,坐等再次活动128，之前都可以半价99买，今年默默涨价了，给家人买的，在搞活动再来两件
李***4,颜色:67 海蓝色;尺码:170/92A/M,2021-01-12 14:40:31,不错的 保暖不错
阿***延,颜色:08 深灰色;尺码:170/92A/M,2021-01-12 11:27:34,整体评价：非常好，大小刚合适，穿起来非常舒服跟暖和！ 尺码推荐：优衣库衣服的正常尺码就可以了。 厚薄度：薄厚适中。
大***线,颜色:08 深灰色;尺码:170/92A/M,2021-01-12 09:14:01,很好 很保暖
荣***0,颜色:08 深灰色;尺码:175/100A/L,2021-01-11 21:44:00,怎么回事我也不知道。就开了一天车就这样了。客服也很忙。说那些我也听不懂。算了
雅***4,颜色:08 深灰色;尺码:170/92A/M,2021-01-11 20:41:34,超级暖和
z***8,颜色:63 天蓝色;尺码:180/108B/XL,2021-01-11 18:43:26,不错，暖和
华***z,颜色:36 褐色;尺码:175/100A/L,2021-01-11 13:42:01,保暖效果不错👍
天***啦,颜色:31 米色;尺码:175/100A/L,2021-01-11 13:27:51,颜色很好看 穿上非常暖和舒服
谷***华,颜色:08 深灰色;尺码:180/108B/XL,2021-01-11 10:14:01,一如既往的好
r***0,颜色:77 灰紫色;尺码:175/100A/L,2021-01-11 10:07:19,超级保暖
焦***纸,颜色:17 枣红色;尺码:175/100A/L,2021-01-11 09:13:40,必须不错，颜色，保暖性均可
丿***梦,颜色:54 绿色;尺码:165/84A/S,2021-01-10 22:08:08,超级暖和～
f***k,颜色:77 灰紫色;尺码:175/100A/L,2021-01-10 21:45:19,这个紫色真的好看哈哈，墨绿同推，灰色也好看
晟***4,颜色:63 天蓝色;尺码:165/84A/S,2021-01-10 21:01:32,毛绒绒的很暖和。
q***栋,颜色:08 深灰色;尺码:170/92A/M,2021-01-10 18:49:21,此用户没有填写评论!
y***e,颜色:63 天蓝色;尺码:170/92A/M,2021-01-10 17:22:12,非常柔软温暖，颜色也好。
我***3,颜色:08 深灰色;尺码:160/76A/XS,2021-01-10 14:38:00,没想到这个颜色有点紫。。。。。客服呵呵。。
在***方,颜色:54 绿色;尺码:170/92A/M,2021-01-10 09:59:45,不错。应该买大一号的
m***z,颜色:17 枣红色;尺码:180/108B/XL,2021-01-09 23:19:45,优衣库从不让我失望
c***3,颜色:08 深灰色;尺码:160/76A/XS,2021-01-09 22:43:18,孩子很喜欢。
不***名,颜色:36 褐色;尺码:170/92A/M,2021-01-09 20:48:10,买的时候129，原价199，挺划算，应该是最便宜的价格了，真的超级保暖，比羽绒还暖。家里一人一件~
l***6,颜色:08 深灰色;尺码:170/92A/M,2021-01-09 19:06:52,给爷爷买的，他非常喜欢
s***5,颜色:08 深灰色;尺码:160/76A/XS,2021-01-09 17:45:42,很好的，一点毛病都没有的
灵***缘,颜色:37 栗色;尺码:170/92A/M,2021-01-09 14:39:56,第二次买了，很暖和 也很柔软
小***朵,颜色:17 枣红色;尺码:180/108B/XL,2021-01-09 13:59:48,👍
z***3,颜色:08 深灰色;尺码:175/100A/L,2021-01-09 13:59:42,优衣库质量不错，确实挺暖的，但不够防风，毕竟不是风衣吧。远看有点像貂皮大衣，哈哈哈
宜***本,颜色:54 绿色;尺码:185/112C/XXL,2021-01-09 12:02:06,看着衣服不错
我***的,颜色:54 绿色;尺码:185/112C/XXL,2021-01-09 11:01:08,面料品质：毛绒绒的。弟弟很喜欢。还不错。颜色也不错
t***儿,颜色:08 深灰色;尺码:180/108B/XL,2021-01-08 22:17:39,很暖和 又舒服 买了很多件 家里快人手一件了
l***h,颜色:08 深灰色;尺码:175/100A/L,2021-01-08 22:06:16,码子正，柔软保暖好，质量可以
5***g,颜色:77 灰紫色;尺码:175/100A/L,2021-01-08 19:46:22,没有色差，颜色很不错，轻且柔软，非常暖和，全家都买了一件，很棒
西***4,颜色:54 绿色;尺码:185/112C/XXL,2021-01-08 19:19:42,舒服，暖和
l***2,颜色:46 鹅黄色;尺码:170/92A/M,2021-01-08 18:11:35,此用户没有填写评论!
无***线,颜色:54 绿色;尺码:185/112C/XXL,2021-01-08 16:47:55,宝贝，正是我需要的，收到的时候包装完整，打开后让我惊喜的是，宝贝比我想象中的还要好！不得不得竖起大拇指。下次需要的时候我还会再来的，到时候麻烦掌柜给个优惠哦！
t***3,颜色:31 米色;尺码:175/100A/L,2021-01-08 16:44:33,非常好，老爸很喜欢😘
涟***深,颜色:08 深灰色;尺码:170/92A/M,2021-01-08 13:49:43,穿着感觉还可以 就是感觉稍微有点色差
i***0,颜色:67 海蓝色;尺码:165/84A/S,2021-01-08 09:56:39,衣服质量很好很保暖，建议打折购买，不然亏大
摩***香,颜色:08 深灰色;尺码:170/92A/M,2021-01-08 06:10:07,很好的商品，物流很快。很好很好很好很好很好很好很好很好很好很好很好很好很好很好很好很好很好很好很好很好很好很好很好
活***2,颜色:08 深灰色;尺码:175/100A/L,2021-01-08 03:13:40,源哥同款才128，和棉服一样暖和，不用再买羽绒服了
c***6,颜色:08 深灰色;尺码:170/92A/M,2021-01-08 00:00:38,跟好多人评价的一样，确实如此，客服形同虚设，有跟没有没区别，问了也不会搭理你的，买了第二三天就降70大洋，服务是没有的，评论不堪是有道理的
蔡***静,颜色:08 深灰色;尺码:180/108B/XL,2021-01-07 20:07:22,很柔软，很舒服，很暖和
y***1,颜色:17 枣红色;尺码:165/84A/S,2021-01-07 19:40:16,柔软厚实轻便，做工也不错
q***1,颜色:36 褐色;尺码:180/108B/XL,2021-01-07 18:25:22,好评
d***8,颜色:59 墨绿色;尺码:170/92A/M,2021-01-07 17:37:16,非常暖和
s***1,颜色:63 天蓝色;尺码:165/84A/S,2021-01-07 17:34:00,中厚，颜色喜欢，稍微买大了点
华***9,颜色:36 褐色;尺码:185/120C/XXXL,2021-01-07 16:52:30,松软不掉毛，轻薄保暖。
埔***哥,颜色:08 深灰色;尺码:170/92A/M,2021-01-07 13:15:33,不错
y***0,颜色:59 墨绿色;尺码:175/100A/L,2021-01-07 10:50:47,保暖又轻
地***丝,颜色:08 深灰色;尺码:185/112C/XXL,2021-01-06 21:39:01,柔软舒服
阳***2,颜色:77 灰紫色;尺码:175/100A/L,2021-01-06 21:04:41,保暖，质量杠杠滴！
搞***棒,颜色:31 米色;尺码:165/84A/S,2021-01-06 19:06:37,此用户没有填写评论!
z***k,颜色:67 海蓝色;尺码:170/92A/M,2021-01-06 16:24:25,很快就收到了，整体还可以
黄***4,颜色:08 深灰色;尺码:185/120C/XXXL,2021-01-06 15:39:29,很暖和
小***芒,颜色:54 绿色;尺码:170/92A/M,2021-01-06 10:11:31,发货速度很快，东西包装的很好，价格优惠，我很满意👍，还会回购宝贝已收到，是我想要的，手感很好，质量也挺好，有问题客服也很快就解决了，态度非常好，一定好评！
k***5,颜色:59 墨绿色;尺码:175/100A/L,2021-01-06 09:44:32,给爸爸买的，他很满意！
j***t,颜色:08 深灰色;尺码:185/112C/XXL,2021-01-06 09:21:15,这个还是不错的商品，品质还可以搞活动更实惠
s***2,颜色:63 天蓝色;尺码:175/100A/L,2021-01-06 08:49:23,材质很好，质量也不错，到货也很快
小***1,颜色:59 墨绿色;尺码:170/92A/M,2021-01-06 08:00:13,老爸穿着很好看很暖和
阿***o,颜色:08 深灰色;尺码:170/92A/M,2021-01-06 02:29:53,整体评价：舒适 材质特性：光滑 暖和 上身效果：合身 尺码推荐：162 M
阿***o,颜色:08 深灰色;尺码:175/100A/L,2021-01-06 02:29:53,整体评价：很舒服 材质特性：很保暖 上身效果：穿着很好 尺码推荐：170L吧
莉***啁,颜色:36 褐色;尺码:175/100A/L,2021-01-06 00:22:56,给男朋友又买了一件，天气太冷等不了最后降到99了，害怕尺码和颜色都没有，所以趁128赶紧先入手。这个冬天我们就靠这个过了，比毛衣啥的做内搭效果都好
丢***7,颜色:08 深灰色;尺码:185/120C/XXXL,2021-01-05 22:57:08,好评，
陈***羽,颜色:08 深灰色;尺码:185/112C/XXL,2021-01-05 19:03:27,挺好的，价格适中，质量看着不错
q***9,颜色:77 灰紫色;尺码:180/108B/XL,2021-01-05 16:54:18,可以
w***s,颜色:08 深灰色;尺码:180/108B/XL,2021-01-05 15:23:12,很保暖，冬天穿一件无敌
梵***1,颜色:67 海蓝色;尺码:165/84A/S,2021-01-05 14:36:36,衣服很合适，很暖和
风***5,颜色:63 天蓝色;尺码:170/92A/M,2021-01-05 13:15:48,很保暖，摇粒绒永远的神，
沈***羡,颜色:77 灰紫色;尺码:175/100A/L,2021-01-05 11:01:40,质量比女款好，非常厚实。婆婆太胖，女款不能穿，买这颜色更漂亮质量更好了
天***市,颜色:08 深灰色;尺码:170/92A/M,2021-01-04 22:27:00,衣服不错，好看。
天***华,颜色:08 深灰色;尺码:165/84A/S,2021-01-04 19:36:11,颜色好像灰紫色！暖和！
m***线,颜色:08 深灰色;尺码:170/92A/M,2021-01-04 17:37:52,整体评价：满意 舒服 材质特性：舒服  上身效果：好穿好搭 尺码推荐：标准 合身 面料品质：保暖舒服
海***6,颜色:17 枣红色;尺码:175/100A/L,2021-01-04 16:44:05,穿上去很帅
b***w,颜色:08 深灰色;尺码:175/100A/L,2021-01-04 16:03:18,好用，一直关注中~~
硕***f,颜色:77 灰紫色;尺码:180/108B/XL,2021-01-04 15:13:58,给老妈买的，颜色穿着挺好看，柔软
v***o,颜色:08 深灰色;尺码:175/100A/L,2021-01-04 13:37:49,适合在家穿，也可以穿出去便宜又暖和
z***6,颜色:31 米色;尺码:180/108B/XL,2021-01-04 12:21:16,还不错❗
t***8,颜色:08 深灰色;尺码:160/76A/XS,2021-01-04 10:24:58,挺好的 暖暖的
d***斑,颜色:08 深灰色;尺码:170/92A/M,2021-01-04 10:23:17,170男女都合适，长度够，袖子不会过长。很舒服，深灰色超级推荐，很好看的，简约。
f***1,颜色:54 绿色;尺码:185/120C/XXXL,2021-01-04 09:13:58,好
x***a,颜色:08 深灰色;尺码:160/76A/XS,2021-01-03 23:20:24,不错，毛茸茸的。很暖和
买***机,颜色:67 海蓝色;尺码:170/92A/M,2021-01-03 23:14:19,很旧像被穿过
买***机,颜色:08 深灰色;尺码:170/92A/M,2021-01-03 23:14:19,很旧像被穿过
x***1,颜色:67 海蓝色;尺码:170/92A/M,2021-01-03 20:47:47,128买的还是很划算的，蓝色和绿色都好看
w***0,颜色:67 海蓝色;尺码:165/84A/S,2021-01-03 19:54:35,不错质量可以放心购买，穿在身上很保暖
w***0,颜色:63 天蓝色;尺码:165/84A/S,2021-01-03 19:54:35,不错，质量可以，穿在身上很保暖，买了两件换着穿
男***己,颜色:08 深灰色;尺码:165/84A/S,2021-01-03 18:28:33,回购4单了。非常不错
男***己,颜色:08 深灰色;尺码:165/84A/S,2021-01-03 18:28:00,特别不错，穿着暖和
t***2,颜色:36 褐色;尺码:185/120C/XXXL,2021-01-03 18:25:46,还行吧
小***场,颜色:37 栗色;尺码:170/92A/M,2021-01-03 18:24:54,非常好
t***7,颜色:42 浅黄色;尺码:175/100A/L,2021-01-03 17:15:11,好喜欢好可爱！！很保暖！
h***0,颜色:54 绿色;尺码:175/100A/L,2021-01-03 15:08:35,摇粒绒这款男的女的孩子的家里每个人3件换着穿舒服的很
o***3,颜色:59 墨绿色;尺码:180/108B/XL,2021-01-03 14:31:25,暖，合适，好
m***1,颜色:08 深灰色;尺码:170/92A/M,2021-01-03 12:00:27,好评，很暖和
l***8,颜色:08 深灰色;尺码:170/92A/M,2021-01-03 11:58:35,收到没有洗就试穿，很轻很暖和，我155，90斤特意选大一点，在家做家务和锻炼都不错
天***理,颜色:77 灰紫色;尺码:175/100A/L,2021-01-03 10:52:00,给家里人买的，紫色不错！
c***b,颜色:63 天蓝色;尺码:175/100A/L,2021-01-03 10:10:03,非常舒服的外套，孩子很喜欢，家里大人小孩每人一件
t***2,颜色:08 深灰色;尺码:170/92A/M,2021-01-02 23:08:35,穿着很暖和 也很合身
q***3,颜色:37 栗色;尺码:175/100A/L,2021-01-02 21:30:03,好评！
q***3,颜色:37 栗色;尺码:180/108B/XL,2021-01-02 21:29:17,好评
p***1,颜色:54 绿色;尺码:185/112C/XXL,2021-01-02 20:48:18,衣服好看 239斤穿xxl合身
吸***乐,颜色:08 深灰色;尺码:180/108B/XL,2021-01-02 16:30:27,合适
韬***宝,颜色:31 米色;尺码:175/100A/L,2021-01-02 16:20:43,轻巧，暖和，非常舒服的一件外套。给家人人手一件。多次购买了。值得推荐！
韬***宝,颜色:59 墨绿色;尺码:180/108B/XL,2021-01-02 16:20:43,轻巧，暖和，非常舒服的一件外套。给家人人手一件。多次购买了。值得推荐！
j***9,颜色:08 深灰色;尺码:175/100A/L,2021-01-02 14:15:39,挺好的，轻便也比较保暖，适合在家里穿，175-140斤穿L合适。
影***0,颜色:77 灰紫色;尺码:180/108B/XL,2021-01-02 13:35:08,质量很好！穿着舒适！颜色很正！
