displayUserNick,auctionSku,rateDate,rateContent
任***q,颜色分类:24 亮橙色;尺码:160/88A/L,2021-02-26 16:13:08,上身效果不错，但是包装真的太太太尴尬了，打结的塑料袋...让人一下觉得low了
t***4,颜色分类:30 浅米色;尺码:155/80A/S,2021-02-25 22:47:31,面料材质：跟实体店一样，非常好 我的身高体重：160公分，120斤&hellip;&hellip;但是很合身，因为我上身小下身胖
人***2,颜色分类:69 藏青色;尺码:165/92A/XL,2021-02-19 21:22:15,简约而不简单
t***6,颜色分类:09 黑色;尺码:170/100B/XXL,2021-02-17 10:59:51,店家发货非常快，服务态度很好，应该是正品，一次很愉快的购物
z***7,颜色分类:30 浅米色;尺码:160/84A/M,2021-02-09 23:06:24,谢谢！
c***n,颜色分类:24 亮橙色;尺码:150/76A/XS,2021-02-09 07:06:28,实物与图片描述一致
l***5,颜色分类:24 亮橙色;尺码:165/92A/XL,2021-02-08 11:57:26,挺好
x***a,颜色分类:24 亮橙色;尺码:160/84A/M,2021-01-29 12:33:04,真棒啊，大小合适，颜色不是很鲜艳，很棒。穿起来舒适，挺阔，随意，比正装好穿多了
