displayUserNick,auctionSku,rateDate,rateContent
m***o,颜色分类:50 浅绿色;尺码:165/92A/XL,2021-02-26 18:55:31,不错
徐***宏,颜色分类:65 宝蓝色;尺码:155/80A/S,2021-02-25 22:39:16,很喜欢的一件羽绒服，轻薄百搭
q***0,颜色分类:01 乳白色;尺码:155/80A/S,2021-02-25 20:35:53,刚收到货就降价100元，找客服不退款，买优衣库最好等打折，不然降价太快太亏
魔***姐,颜色分类:50 浅绿色;尺码:160/84A/M,2021-02-24 21:10:55,老妈很满意，赶上打折非常划算！自己也想来一件！
q***5,颜色分类:50 浅绿色;尺码:160/88A/L,2021-02-24 19:06:29,很温柔的绿色，喜欢
杀***3,颜色分类:50 浅绿色;尺码:165/92A/XL,2021-02-24 18:17:45,超级美太喜欢了这个色专柜断货了
l***2,颜色分类:34 驼色;尺码:160/84A/M,2021-02-24 15:46:54,喜欢
s***j,颜色分类:50 浅绿色;尺码:160/84A/M,2021-02-24 15:36:24,还不错，特别轻薄，出门戴着也方便
t***7,颜色分类:50 浅绿色;尺码:165/92A/XL,2021-02-24 14:52:03,简约风，很轻薄，买了一次都没穿，舍不得退。。。
五***毛,颜色分类:50 浅绿色;尺码:160/84A/M,2021-02-21 18:18:24,很轻很舒服
z***z,颜色分类:50 浅绿色;尺码:160/88A/L,2021-02-19 15:36:29,在门店试的时候就很喜欢，后来打算等一等再买，没想到等到了涨价，吓得我赶紧入手，期待春天的到来
a***肉,颜色分类:50 浅绿色;尺码:160/84A/M,2021-02-19 11:26:57,也是因为这个颜色和款式才会399买个这么薄的羽绒服，初春了现在，大太阳天穿它加衬衫都还不是很热，有点冷，配浅色衣服好看。
艳***9,颜色分类:34 驼色;尺码:170/100B/XXL,2021-02-19 08:08:38,比其他款型偏大 挺好看 简单随意
妙***4,颜色分类:50 浅绿色;尺码:155/80A/S,2021-02-18 10:39:44,好看
妙***4,颜色分类:34 驼色;尺码:155/80A/S,2021-02-18 10:39:33,好看
t***5,颜色分类:50 浅绿色;尺码:160/84A/M,2021-02-17 21:19:51,买了两色，最后留了绿色，春天很清新。
如***初,颜色分类:34 驼色;尺码:165/92A/XL,2021-02-17 19:44:36,买来送外婆的，外婆穿着颗开心了。就版型比较大，还好可以在实体店更换尺码。就很nice
t***3,颜色分类:65 宝蓝色;尺码:160/88A/L,2021-02-16 17:20:48,颜色漂亮，衣服也好
开***3,颜色分类:50 浅绿色;尺码:160/84A/M,2021-02-16 16:32:33,颜色好看 就是面料有点薄
z***0,颜色分类:65 宝蓝色;尺码:155/80A/S,2021-02-16 09:46:04,看了集美们的穿衣体验，我160 47kg，一般上衣我都买m，这款我买了s很合适。
蜡***3,颜色分类:50 浅绿色;尺码:160/84A/M,2021-02-16 08:04:13,不错
深***e,颜色分类:50 浅绿色;尺码:160/88A/L,2021-02-15 00:31:38,太薄了，衣服穿上去显得更胖，像个老太太。
m***4,颜色分类:50 浅绿色;尺码:155/80A/S,2021-02-14 22:03:23,第一天499拍的，第二天降到399，我货还没收到的情况下，客服*活不同意退差价，非让我退货重拍，你们自己降价导致的差价，至少7天内要允许退差价吧？淘宝这么久，官方旗舰店也买过很多次，人家家都能退，为什么你们不可以退？退换货浪费人力物力，也是一种资源浪费，为何如此折腾，非常不人性化，什么年代了，这么大一个店，处理问题竟然如此*板不变通，优衣库这样的售后方式真是令人失望，耽误事！还有这衣服，我也就是喜欢这个颜色，我妈看了都说只值199
t***1,颜色分类:50 浅绿色;尺码:155/80A/S,2021-02-14 16:43:00,可以
t***5,颜色分类:50 浅绿色;尺码:155/80A/S,2021-02-14 12:50:47,此用户没有填写评论!
世***好,颜色分类:50 浅绿色;尺码:160/88A/L,2021-02-13 23:29:19,买了一白一绿 好看的 绿色比白色质量要好 白色有点味道 而且没有绿色柔软
麦***嘣,颜色分类:50 浅绿色;尺码:165/92A/XL,2021-02-13 17:37:02,在实体店里买了白色，又网购了浅绿色，太美了。平时m，这款xl，好有范儿。158，52公斤。
t***3,颜色分类:50 浅绿色;尺码:160/88A/L,2021-02-12 19:58:18,好
饼***果,颜色分类:50 浅绿色;尺码:160/84A/M,2021-02-12 17:41:19,很好看的颜色，过于轻薄！怎奈太喜欢！
小***i,颜色分类:01 乳白色;尺码:165/92A/XL,2021-02-12 12:45:35,好看的，店里早就没了
h***3,颜色分类:65 宝蓝色;尺码:155/80A/S,2021-02-11 13:11:01,满意
我***飞,颜色分类:01 乳白色;尺码:160/88A/L,2021-02-11 12:22:32,此用户没有填写评论!
我***权,颜色分类:34 驼色;尺码:155/80A/S,2021-02-10 22:38:12,家居服穿，舒服。
a***n,颜色分类:65 宝蓝色;尺码:160/84A/M,2021-02-10 21:04:39,轻薄，好看，百搭
_***n,颜色分类:50 浅绿色;尺码:160/84A/M,2021-02-10 16:40:02,搭配我浅绿色的卫衣挺好的，薄是真的薄。
l***w,颜色分类:65 宝蓝色;尺码:165/92A/XL,2021-02-10 13:57:34,可以，当打底外穿都行
关***巴,颜色分类:09 黑色;尺码:155/80A/S,2021-02-09 18:20:15,一般吧，399不值这个价
芈***3,颜色分类:65 宝蓝色;尺码:160/88A/L,2021-02-09 09:43:01,好看好穿还暖和
f***l,颜色分类:50 浅绿色;尺码:160/88A/L,2021-02-09 04:37:44,很舒服很轻，特意等到打折来买哈哈哈
白***芊,颜色分类:09 黑色;尺码:165/92A/XL,2021-02-08 21:33:04,衣服版型好，轻盈，但是这个价位，钻毛有点严重，原价499d不算便宜了，起码做到不钻毛吧，防水倒是大可不必，个人觉得对码数要求不高的，不介意明年穿的，可以蹲谷底价
青***2,颜色分类:50 浅绿色;尺码:165/92A/XL,2021-02-08 20:33:25,非常好。
仙***优,颜色分类:50 浅绿色;尺码:155/80A/S,2021-02-08 20:19:23,怀孕9个月穿s正好 166/60身高体重给大家参考
2***鱼,颜色分类:65 宝蓝色;尺码:160/88A/L,2021-02-08 20:02:39,太差劲了刚买完就降价100
宝***3,颜色分类:34 驼色;尺码:160/88A/L,2021-02-08 13:23:35,好穿
h***3,颜色分类:01 乳白色;尺码:155/80A/S,2021-02-07 20:13:51,又舒服又好看
v***0,颜色分类:50 浅绿色;尺码:160/88A/L,2021-02-07 19:45:56,浅绿色太好看了，肤白的人穿的很嫩
凯***0,颜色分类:01 乳白色;尺码:160/88A/L,2021-02-07 18:06:03,太好看了，上身舒服😌
c***7,颜色分类:50 浅绿色;尺码:155/80A/S,2021-02-07 15:46:07,挺好
傻***0,颜色分类:50 浅绿色;尺码:160/88A/L,2021-02-07 15:22:35,很好，颜色喜欢，现在穿正好。
我***1,颜色分类:01 乳白色;尺码:165/92A/XL,2021-02-07 09:47:59,好评
浅***弦,颜色分类:01 乳白色;尺码:160/88A/L,2021-02-07 08:51:03,是比较薄的款，里面的羽绒不是很多，款式不错，但是有点买大了。
a***1,颜色分类:50 浅绿色;尺码:160/88A/L,2021-02-06 20:22:17,好
不***a,颜色分类:65 宝蓝色;尺码:160/84A/M,2021-02-06 19:58:59,不错，穿在工作服里面正好
小***0,颜色分类:50 浅绿色;尺码:155/80A/S,2021-02-06 18:00:27,爆款，本来也很喜欢白色，想两件都入的，但是价格实在太贵，说实话，颜色不错，版型也可以，但充绒量真的太少了，不值399，最多199
小***7,颜色分类:65 宝蓝色;尺码:160/84A/M,2021-02-06 17:52:11,颜色很漂亮，气质
小***7,颜色分类:50 浅绿色;尺码:160/84A/M,2021-02-06 08:01:30,很轻盈，颜色漂亮
a***5,颜色分类:50 浅绿色;尺码:160/84A/M,2021-02-05 12:45:29,不错的
m***3,颜色分类:01 乳白色;尺码:160/88A/L,2021-02-05 12:34:05,被优衣库割了一波韭菜，从买到收货前前后后才10多天吊牌还没摘，就降价了，果然买她们家的衣服要佛系
x***2,颜色分类:65 宝蓝色;尺码:155/80A/S,2021-02-05 11:55:04,买给妈**，时尚又保暖
超***1,颜色分类:34 驼色;尺码:155/80A/S,2021-02-04 09:12:36,不错
s***9,颜色分类:34 驼色;尺码:165/92A/XL,2021-02-03 18:10:53,同款第二件，轻薄保暖，武汉10度左右穿非常合适
司***尔,颜色分类:09 黑色;尺码:170/100B/XXL,2021-02-03 15:45:09,非常轻薄，买给家人的，很合适
茉***9,颜色分类:34 驼色;尺码:155/80A/S,2021-02-02 19:26:31,漂亮 轻盈暖 好看
承***8,颜色分类:50 浅绿色;尺码:165/92A/XL,2021-02-02 16:44:32,就是太太太太薄了 比之前买的所有轻羽绒都薄 但是好看的
t***9,颜色分类:50 浅绿色;尺码:160/84A/M,2021-02-02 15:37:39,整体评价：颜色很好看 版型风格：偏大 材质厚度：薄 搭配建议：宽松版型
t***5,颜色分类:50 浅绿色;尺码:160/84A/M,2021-02-02 12:51:00,穿着好看 也很保暖
杨***6,颜色分类:65 宝蓝色;尺码:160/88A/L,2021-02-02 12:47:24,版型很大，老妈158，130斤穿L正好
l***1,颜色分类:50 浅绿色;尺码:160/84A/M,2021-02-01 21:38:50,整体评价：薄，轻，微透光，充绒量极少 版型风格：做内搭花499确实不值，如果造型外搭499可以考虑购买，它只能做外搭配，建议做外搭大一码这样才出型，着实贵的很。1 材质厚度：薄到透光，没任何重量。 搭配建议：建议外搭 我的身高体重：155高95斤。 庆幸发来不是脏的也不是残次品，不然如评论说的脏了拒收不退不换没回复那就认栽吧。
超***咪,颜色分类:01 乳白色;尺码:155/80A/S,2021-02-01 20:25:26,没有见过这么差的优衣库，客服态度恶劣，要不就是不回消息！寄了一件脏衣服过来，我退货退款，都寄回去了，优衣库直接给我拒绝，让我拍吊牌！你们寄脏东西给我，没有一句抱歉，还说我没拍吊牌发过来！！！你们的错误打扰我的生活，让我买单？？？
e***3,颜色分类:50 浅绿色;尺码:160/84A/M,2021-02-01 11:49:15,颜色真是太好看了
不***3,颜色分类:50 浅绿色;尺码:160/84A/M,2021-02-01 07:11:32,颜色好看，可是穿了一次就显旧了，不值399
蕾***g,颜色分类:01 乳白色;尺码:170/100B/XXL,2021-01-31 18:23:52,168、95斤睡裤买家秀，然后好薄好贵，但是还是喜欢版型～
爱***7,颜色分类:50 浅绿色;尺码:155/80A/S,2021-01-31 15:07:08,绿色好看，内搭外穿都可
g***1,颜色分类:50 浅绿色;尺码:160/88A/L,2021-01-31 12:06:24,穿里面打底很好看
若***2,颜色分类:09 黑色;尺码:160/88A/L,2021-01-31 09:26:38,一次买了多件，都很满意
5***晶,颜色分类:09 黑色;尺码:150/76A/XS,2021-01-30 16:35:05,轻羽绒穿了感觉没穿一样却很保暖！
波***2,颜色分类:65 宝蓝色;尺码:155/80A/S,2021-01-30 11:06:42,超好
t***7,颜色分类:65 宝蓝色;尺码:160/84A/M,2021-01-30 08:26:15,略宽松
女***o,颜色分类:50 浅绿色;尺码:160/84A/M,2021-01-29 22:21:03,很好看，质量也很好，物流也很快，非常喜欢。
阿***n,颜色分类:65 宝蓝色;尺码:165/92A/XL,2021-01-29 20:34:28,物超所值，话不多说，这四个字已经说明了一切
b***a,颜色分类:65 宝蓝色;尺码:155/80A/S,2021-01-29 19:44:39,好看的
栀***央,颜色分类:50 浅绿色;尺码:160/84A/M,2021-01-29 19:38:28,好评
t***4,颜色分类:01 乳白色;尺码:160/84A/M,2021-01-29 12:02:02,收到的衣服粘了很多毛，袖口还很脏&hellip;&hellip;这是穿过么🤷🏻&zwj;♀️🤷🏻&zwj;♀️物流过了六天才收到，非常慢&hellip;&hellip;
神***儿,颜色分类:50 浅绿色;尺码:175/108C/XXXL,2021-01-28 20:23:40,好看！快买！
张***店,颜色分类:01 乳白色;尺码:170/100B/XXL,2021-01-28 17:36:28,超级轻 跟没穿一样，这个白色有点薄，很透里面的羽毛
z***9,颜色分类:09 黑色;尺码:160/84A/M,2021-01-28 16:50:54,做工精细，薄薄的绒，姑娘穿毛衣外面又休闲又时尚又保暖，宽松版的大小正好，姑娘很喜欢
z***b,颜色分类:50 浅绿色;尺码:160/88A/L,2021-01-28 16:44:23,挺薄的一件，充绒量不高，买来搭优衣库的西装的
矮***花,颜色分类:50 浅绿色;尺码:155/80A/S,2021-01-28 16:26:47,好看
舜***6,颜色分类:65 宝蓝色;尺码:160/88A/L,2021-01-28 15:15:13,衣服偏大，平日穿L，这件衣服买的L穿出了XL效果😂
黑***q,颜色分类:50 浅绿色;尺码:155/80A/S,2021-01-28 07:58:30,轻羽绒上身很舒服
超***仙,颜色分类:50 浅绿色;尺码:155/80A/S,2021-01-27 20:09:00,很好看～
c***e,颜色分类:09 黑色;尺码:155/80A/S,2021-01-27 19:25:30,外穿内搭都可以，款式比那种横条的洋气很多，我是买来配大衣穿的，大小合适，黑色也很好搭配
纯***o,颜色分类:65 宝蓝色;尺码:160/84A/M,2021-01-27 12:22:26,非常舒适 有型，颜色清新！
s***i,颜色分类:50 浅绿色;尺码:165/92A/XL,2021-01-27 06:19:26,轻便，颜色也太可了
龙***1,颜色分类:09 黑色;尺码:155/80A/S,2021-01-26 23:38:37,可以
l***e,颜色分类:65 宝蓝色;尺码:160/84A/M,2021-01-26 18:50:32,买了两件，宝蓝色给妈妈，很实用很保暖
l***e,颜色分类:50 浅绿色;尺码:155/80A/S,2021-01-26 18:50:32,浅绿色很好看，很淡的绿色
s***s,颜色分类:01 乳白色;尺码:160/84A/M,2021-01-26 13:22:59,买的m码，穿着有些大，但想着里面还能再塞些衣服，就懒得退换货了。配风衣大衣之类的，简直不要太好！百搭款，喜欢！
g***0,颜色分类:65 宝蓝色;尺码:160/84A/M,2021-01-26 12:52:39,很快很好
末***7,颜色分类:50 浅绿色;尺码:160/84A/M,2021-01-26 08:28:58,此用户没有填写评论!
b***b,颜色分类:09 黑色;尺码:160/84A/M,2021-01-26 00:16:49,158买的m号 长短正好 买大一号
小***9,颜色分类:01 乳白色;尺码:155/80A/S,2021-01-25 22:04:47,拆开快递后发现右边的口袋被黑色笔给点了一下，本来想退货的，但是后来发现一直没有再降回399，只能勉强收货了，因为这件外套够大，里面还能再穿一件外套
p***p,颜色分类:65 宝蓝色;尺码:160/84A/M,2021-01-25 21:02:32,165，53M非常好看，这款胸围和下摆很宽大。发货和物流都很快
真***6,颜色分类:50 浅绿色;尺码:160/84A/M,2021-01-25 20:16:32,颜色衬肤，薄
金***g,颜色分类:01 乳白色;尺码:160/84A/M,2021-01-25 17:26:34,整体评价：很久前就在实体店试过，意外的很好看，收到以后果然没让我失望，就是稍微有一股鸭绒味。 我的身高体重：160cm，45kg 材质厚度：很轻薄，保暖还行，十度左右的天可以穿
w***9,颜色分类:50 浅绿色;尺码:160/84A/M,2021-01-25 15:27:20,无色差
m***2,颜色分类:65 宝蓝色;尺码:155/80A/S,2021-01-25 13:40:32,柔软轻巧，式样喜欢，颜色也漂亮
y***贝,颜色分类:65 宝蓝色;尺码:160/88A/L,2021-01-25 03:49:49,宝贝是性价比很高的，我每次都会先试用再评价的，虽然宝贝不一定是最好的，但在同等的价位里面绝对是表现最棒的。
t***5,颜色分类:65 宝蓝色;尺码:160/84A/M,2021-01-24 23:20:20,尺码偏大
t***5,颜色分类:09 黑色;尺码:160/84A/M,2021-01-24 23:19:47,尺码偏大
x***g,颜色分类:65 宝蓝色;尺码:155/80A/S,2021-01-24 22:22:36,Ok
s***麦,颜色分类:50 浅绿色;尺码:160/88A/L,2021-01-24 20:20:09,衣服好看不会搭配，本来想退的，点错了，&yen;399买的有想要的全新带吊牌。id：shiny麦麦
c***0,颜色分类:34 驼色;尺码:160/84A/M,2021-01-24 20:14:21,买大了，在实体店换小了一号。不错
l***r,颜色分类:65 宝蓝色;尺码:160/88A/L,2021-01-24 15:38:01,超轻薄，差不多一两，喜欢这款式偏宽松，上身效果也很好看
v***e,颜色分类:01 乳白色;尺码:170/100B/XXL,2021-01-24 10:22:34,轻薄的羽绒服，一点重量都感受不到，很宽松，是我要的休闲风。很喜欢。蹲了好久才蹲到xxl号。
t***4,颜色分类:01 乳白色;尺码:155/80A/S,2021-01-23 23:04:34,做工精细 轻薄舒适
t***4,颜色分类:34 驼色;尺码:155/80A/S,2021-01-23 22:20:04,很好👌！颜色很好看，显得很高级的质感。
晴***朗,颜色分类:50 浅绿色;尺码:165/92A/XL,2021-01-23 22:18:18,又轻又暖又显胖哈哈哈哈哈哈哈适合居家穿
e***s,颜色分类:65 宝蓝色;尺码:155/80A/S,2021-01-23 20:46:58,款式颜色都挺好，但是充绒很少，许多格子里几乎没有绒都透着光，竟还有羽绒臭味，就算399性价比也实在是一般
敏***5,颜色分类:09 黑色;尺码:165/92A/XL,2021-01-23 18:10:54,穿起来超轻便，穿了就不想穿别的棉衣了。就是不那么太暖和。我身高165 体重120，穿XL袖子和衣服长短正好。
悠***k,颜色分类:09 黑色;尺码:160/84A/M,2021-01-23 17:24:16,外穿很好👍，正常买的尺码，外穿不觉得大。
某***秦,颜色分类:50 浅绿色;尺码:155/80A/S,2021-01-23 12:12:30,很轻便，颜色超级好看，动的时候衣服摩擦有一点声音。
b***o,颜色分类:65 宝蓝色;尺码:160/84A/M,2021-01-23 11:57:02,好看适合时冷时热的天气，但是钻绒
y***6,颜色分类:34 驼色;尺码:155/80A/S,2021-01-22 18:39:37,很喜欢这衣服颜色，宽松型遮肚。面料柔软，试了一下，里外都可以穿，很实用。
s***d,颜色分类:09 黑色;尺码:155/80A/S,2021-01-22 13:16:55,好
入***分,颜色分类:65 宝蓝色;尺码:160/84A/M,2021-01-22 12:57:59,好
o***丫,颜色分类:50 浅绿色;尺码:160/88A/L,2021-01-22 11:19:29,颜色漂亮
有***s,颜色分类:50 浅绿色;尺码:155/80A/S,2021-01-22 09:31:19,还不错
2***l,颜色分类:09 黑色;尺码:160/84A/M,2021-01-22 07:59:24,很满意
k***0,颜色分类:50 浅绿色;尺码:165/92A/XL,2021-01-21 21:33:54,淡绿色很好看，比白色好看，也不是老气的颜色，春天穿很好，1.6，130斤穿M就可以，外穿所以买了XL码
n***宝,颜色分类:65 宝蓝色;尺码:165/92A/XL,2021-01-21 16:21:23,打开包装一股鸭绒的臭味，要散散的，十二度左右穿在卫衣外面还行
d***1,颜色分类:65 宝蓝色;尺码:160/84A/M,2021-01-21 16:14:45,好好看，颜色好看，款式可以外穿也可以当内胆，爱了。
心***4,颜色分类:65 宝蓝色;尺码:155/80A/S,2021-01-21 15:08:57,同事都说好看呢
a***e,颜色分类:01 乳白色;尺码:155/80A/S,2021-01-20 23:20:58,好看，轻便保暖
t***9,颜色分类:65 宝蓝色;尺码:165/92A/XL,2021-01-20 23:10:08,宝贝收到了很满意哦给你5分
弄***a,颜色分类:01 乳白色;尺码:155/80A/S,2021-01-20 20:38:17,在办公室暖空调房里穿穿很好。是优衣库难得很好看的款式。170，102，买的s，合身，但袖子短了点，当九分袖穿穿吧～
怡***0,颜色分类:50 浅绿色;尺码:170/100B/XXL,2021-01-20 20:16:34,暖和，舒服
堂***鱼,颜色分类:65 宝蓝色;尺码:155/80A/S,2021-01-20 16:51:07,大小合适
t***8,颜色分类:65 宝蓝色;尺码:160/84A/M,2021-01-20 14:59:26,薄而暖 发货很快
l***1,颜色分类:65 宝蓝色;尺码:160/84A/M,2021-01-20 11:15:54,轻薄保暖 质量好 满意五分 我的身高体重：164厘米 53公斤
苦***蜜,颜色分类:50 浅绿色;尺码:160/84A/M,2021-01-20 11:15:23,薄是真的薄
开***7,颜色分类:65 宝蓝色;尺码:155/80A/S,2021-01-20 10:23:31,充当打底
快***t,颜色分类:50 浅绿色;尺码:165/92A/XL,2021-01-20 09:42:55,好，店里看到，网上买的，经常是优惠价399，499的时候别买
x***0,颜色分类:01 乳白色;尺码:160/88A/L,2021-01-19 21:23:15,懒得说了，买来穿第一次，晚上脱下来，羽绒粘的身上都是
璎***猪,颜色分类:50 浅绿色;尺码:160/84A/M,2021-01-19 21:13:18,开春了就可以穿，款式不错，降价会再买一件
凤***g,颜色分类:65 宝蓝色;尺码:155/80A/S,2021-01-19 21:08:32,身高163体重118斤，买的s号，大小很合适，内面还可穿个优衣库羽绒背心，衣服穿着练瑜伽也挺好，轻便舒适又保暖
小***几,颜色分类:09 黑色;尺码:155/80A/S,2021-01-19 16:37:12,有始以来发货最慢的一次优衣库一看记录是从大河北来的大概是检验检疫用了好久吧
d***0,颜色分类:65 宝蓝色;尺码:160/84A/M,2021-01-19 15:34:48,好
d***0,颜色分类:34 驼色;尺码:160/88A/L,2021-01-19 15:34:48,还不错
m***u,颜色分类:50 浅绿色;尺码:160/88A/L,2021-01-19 14:15:55,面料真的差到爆 穿上真的不肯退
t***6,颜色分类:01 乳白色;尺码:160/88A/L,2021-01-19 13:49:16,好看
黑***跳,颜色分类:01 乳白色;尺码:175/108C/XXXL,2021-01-19 10:20:04,材质厚度：羽绒服，算了吧，这是两层涤纶布之间夹了点毛 版型风格：老年人的打底羽绒内胆 搭配建议：模特穿了都好看，常人穿了会透底。里面衣服颜色一目了然
小***9,颜色分类:34 驼色;尺码:165/92A/XL,2021-01-19 09:45:25,物流快，羽绒夹克轻薄柔软质量好，满意～
映***天,颜色分类:09 黑色;尺码:170/100B/XXL,2021-01-18 21:46:33,非常感谢
t***2,颜色分类:65 宝蓝色;尺码:155/80A/S,2021-01-18 14:37:40,懒得拍上身照了 大衣里面的就是那件衣服 很轻很薄 可以当内搭吧 颜色也挺好看的哦
逸***q,颜色分类:65 宝蓝色;尺码:160/84A/M,2021-01-18 13:10:46,整体评价：太大了
逸***q,颜色分类:34 驼色;尺码:160/88A/L,2021-01-18 13:10:46,整体评价：太大了
s***9,颜色分类:50 浅绿色;尺码:170/100B/XXL,2021-01-18 08:42:25,这件必须好评！很轻，款式质量都很满意。尤其是快递，隔天就到相当给力，希望保持！感谢优衣库
七***7,颜色分类:50 浅绿色;尺码:155/80A/S,2021-01-17 20:31:42,颜值真的很高，但是衣服在冬天就只能作为内搭，当外套很冷。只有45g填充量，四百块钱买还是很贵的
小***e,颜色分类:01 乳白色;尺码:160/84A/M,2021-01-17 18:13:39,店里试穿过，尺码偏大，穿里面的话要买小一号
y***6,颜色分类:50 浅绿色;尺码:155/80A/S,2021-01-17 17:17:24,这件衣服在尺码和颜色上纠结了好久，买的时候线上没白色就买了绿色s，怕偏大买小了一码，结果去店里自提的时候居然有白色，但是只有m码，两个码数穿上就是两种不一样的感觉，小码感觉太像棉袄心了，就换了白色m，回来套了套感觉还可以，挺实用
王***3,颜色分类:50 浅绿色;尺码:165/92A/XL,2021-01-17 16:30:20,刚收到货就降价100元   联系客服服务态度差  还不给退差价  差评差评
6***a,颜色分类:09 黑色;尺码:160/88A/L,2021-01-17 16:14:36,门店试了一下，可以搭一切的外套
娴***1,颜色分类:34 驼色;尺码:155/80A/S,2021-01-17 15:58:09,是我喜欢的样式，nice
b***e,颜色分类:34 驼色;尺码:160/88A/L,2021-01-17 15:26:54,买大一号很合适，很轻，江苏现在单穿不保暖不抗风，天暖了穿吧
3***3,颜色分类:50 浅绿色;尺码:160/84A/M,2021-01-17 14:42:12,颜色绝美哈哈哈哈哈哈 就是有点显肩宽，不过我本来就肩宽
t***0,颜色分类:09 黑色;尺码:170/100B/XXL,2021-01-17 13:28:51,刚刚到货就降价一百，还不让退差价，霸王条款
t***1,颜色分类:50 浅绿色;尺码:165/92A/XL,2021-01-16 23:40:46,大了，绿色没货换不了
n***m,颜色分类:50 浅绿色;尺码:160/84A/M,2021-01-16 22:49:08,买完就降价100太气人了啊！
轻***8,颜色分类:50 浅绿色;尺码:175/108C/XXXL,2021-01-16 19:50:50,不错！
t***1,颜色分类:65 宝蓝色;尺码:160/84A/M,2021-01-16 16:51:16,刚到就看到降价到399了 也不能补差价 算了 懒得来回退 还是店里方便
哐***9,颜色分类:65 宝蓝色;尺码:155/80A/S,2021-01-16 16:08:42,不错
t***0,颜色分类:34 驼色;尺码:160/88A/L,2021-01-16 15:40:32,客服态度真的想给差评！！！
l***2,颜色分类:50 浅绿色;尺码:160/84A/M,2021-01-16 14:22:00,衣服挺好，就是买了没多久就便宜100块 心塞
吵***树,颜色分类:01 乳白色;尺码:160/84A/M,2021-01-16 13:06:38,暖和，好看，很不错哦
迷***y,颜色分类:50 浅绿色;尺码:160/84A/M,2021-01-16 11:11:16,最近天天穿，吃火锅别穿，不能洗
阿***仙,颜色分类:09 黑色;尺码:155/80A/S,2021-01-16 08:39:58,很暖
素***3,颜色分类:09 黑色;尺码:175/108C/XXXL,2021-01-16 06:09:01,还没收到货就降价 差评
半***i,颜色分类:09 黑色;尺码:165/92A/XL,2021-01-15 17:25:53,去年买了件长款很不错，所以今年买件短款羽绒服
卡***夫,颜色分类:01 乳白色;尺码:160/84A/M,2021-01-15 13:25:16,在店里试穿了以后，降价买的，真香
j***5,颜色分类:01 乳白色;尺码:160/84A/M,2021-01-15 08:34:46,买给孙女冬天穿在校服里面的，宝宝说舒服暖和，优衣库官方旗舰店的东西不用说，质量杠杠滴！👍👍👍
黄***普,颜色分类:50 浅绿色;尺码:160/84A/M,2021-01-14 07:54:26,确实浅绿色好看
兰***c,颜色分类:50 浅绿色;尺码:155/80A/S,2021-01-14 00:42:54,好评，比较薄但是还算暖和，南方穿OK。
咯***o,颜色分类:50 浅绿色;尺码:170/100B/XXL,2021-01-13 21:49:28,买大了一号不过懒得退啦
凤***0,颜色分类:01 乳白色;尺码:160/88A/L,2021-01-13 17:02:09,很实用
比***z,颜色分类:50 浅绿色;尺码:165/92A/XL,2021-01-13 11:49:14,又轻又暖，好春天啊，稳～
这***的,颜色分类:34 驼色;尺码:160/88A/L,2021-01-13 08:38:16,优衣库的物流真的是相当的快，给妈妈买的，颜色她不太爱，但是很轻薄很舒服，材质她相当喜欢。
k***1,颜色分类:65 宝蓝色;尺码:160/84A/M,2021-01-12 15:46:39,好评
m***7,颜色分类:50 浅绿色;尺码:160/88A/L,2021-01-12 11:40:43,172cm，肩宽39，60kg，这个尺寸还挺宽松的。我是穿在里面当内搭。但如果再小一号袖子有点短。颜色和款式我喜欢。实用性也很好。
小***诺,颜色分类:50 浅绿色;尺码:160/88A/L,2021-01-11 14:46:27,买给奶奶穿 好像尺码有点大
t***8,颜色分类:34 驼色;尺码:160/88A/L,2021-01-11 14:05:21,衣服是宽松的 就是小贵 前几天店里卖399犹豫了没买 在这里卖499 买了哈 质量很好 喜欢
t***7,颜色分类:01 乳白色;尺码:155/80A/S,2021-01-11 09:24:33,衣服不错 老婆很喜欢
l***5,颜色分类:34 驼色;尺码:150/76A/XS,2021-01-11 00:36:33,买了没几天还没确认收货就降价100，还不退差价
