displayUserNick,auctionSku,rateDate,rateContent
j***7,颜色:32 深米色;尺码:170/80A/M,2021-03-05 10:19:28,裤子不错，买了三条，比之前在实体店买的柔软点。打折买的便宜，人瘦了不是很好买裤子，能选中真的不容易，
h***5,颜色:56 橄榄色;尺码:170/80A/M,2021-03-02 07:30:03,厚实舒适，修身好看，大小正好，值得上手。
t***1,颜色:56 橄榄色;尺码:170/80A/M,2021-03-01 21:28:49,Good fit
t***1,颜色:32 深米色;尺码:170/80A/M,2021-03-01 21:28:49,Good fit
刘***3,颜色:69 藏青色;尺码:165/72A/S,2021-03-01 10:12:34,客服不理人，一直自动回复
m***4,颜色:32 深米色;尺码:170/80A/M,2021-02-28 13:49:29,质量不错好看，一直关注。
哼***0,颜色:56 橄榄色;尺码:170/80A/M,2021-02-27 21:57:54,灯芯绒的材质，厚度可以，希望不掉色。
乐***m,颜色:32 深米色;尺码:165/72A/S,2021-02-26 17:17:55,比前年那款含棉量少了一点
梦***速,颜色:32 深米色;尺码:170/80A/M,2021-02-25 18:11:36,此用户没有填写评论!
呼***吸,颜色:32 深米色;尺码:175/88A/L,2021-02-25 17:38:58,挺好的，性价比高
x***1,颜色:32 深米色;尺码:165/72A/S,2021-02-25 09:51:26,很好
t***3,颜色:32 深米色;尺码:170/80A/M,2021-02-24 17:30:44,此用户没有填写评论!
e***0,颜色:38 深褐色;尺码:165/72A/S,2021-02-23 20:33:18,很好 上身效果：很修身
h***t,颜色:56 橄榄色;尺码:165/72A/S,2021-02-23 09:08:15,贪便宜买了，可是搭配什么鞋子却发愁了
淘***r,颜色:69 藏青色;尺码:165/72A/S,2021-02-22 21:46:52,就是黑色，挺厚实的。
w***6,颜色:38 深褐色;尺码:175/88A/L,2021-02-22 17:47:39,"购买的东西已经收到了，商品质量确实非常的好，与卖家描述的完全一致，这个正是我想要的，可以说是非常满意,真的很喜欢，完全超出了最初的期望值，物流速度非常的快，包装也非常仔细、严实，快递小哥服务态度很好，运送速度很快，很满意的一次购物，给力！！"
t***3,颜色:56 橄榄色;尺码:165/72A/S,2021-02-22 14:42:47,非常好的一条裤子，这个颜色加上这个质感就感觉很有档次，老公穿起来刚刚好，对优衣库路转粉
f***c,颜色:32 深米色;尺码:180/96B/XL,2021-02-22 14:20:39,给我老公囤货 质量没得挑 一如既往的好
我***4,颜色:32 深米色;尺码:170/80A/M,2021-02-21 23:48:08,修身 胖的人不要买啦
l***4,颜色:56 橄榄色;尺码:180/96B/XL,2021-02-21 17:30:41,我老公穿显得腿长 版型很合适
缤***众,颜色:32 深米色;尺码:165/72A/S,2021-02-21 12:23:48,很不错，弹力修身，面料舒服。就是会发热，夏天是穿不了了。
慧***3,颜色:69 藏青色;尺码:165/72A/S,2021-02-20 22:59:16,还行吧
唯***y,颜色:69 藏青色;尺码:165/72A/S,2021-02-20 16:15:23,裤子不错，就是沾灰厉害！发货速度也很快
v***n,颜色:56 橄榄色;尺码:170/80A/M,2021-02-19 22:15:58,还可以，这价格可以说非常香了，暂时不打算穿，等11月份再穿啦。优衣库永远滴神，yyds！！！！
z***s,颜色:56 橄榄色;尺码:180/96B/XL,2021-02-18 23:29:47,上身效果：颜色不好配衣服啊&hellip;&hellip;
守***人,颜色:69 藏青色;尺码:165/72A/S,2021-02-18 22:41:12,挺好看的，但是有点长了
j***4,颜色:32 深米色;尺码:165/72A/S,2021-02-18 15:14:38,裤长略比修身款的非灯芯绒面料的休闲裤要短一些
x***5,颜色:32 深米色;尺码:170/80A/M,2021-02-18 11:53:08,勾线了，按客服指导操作，却被拒绝
b***t,颜色:69 藏青色;尺码:165/72A/S,2021-02-17 17:48:50,不错
逸***k,颜色:32 深米色;尺码:165/72A/S,2021-02-17 16:22:04,有点紧
g***a,颜色:32 深米色;尺码:180/96B/XL,2021-02-17 11:10:26,修身款，有点像秋裤
z***5,颜色:56 橄榄色;尺码:165/72A/S,2021-02-17 10:51:43,整体评价：一直穿优衣库的裤子，版型都很合身
j***8,颜色:56 橄榄色;尺码:175/88A/L,2021-02-17 07:17:31,裤子有弹性很舒服，而且有两条松紧带子设计很走心。
夕***戏,颜色:69 藏青色;尺码:165/72A/S,2021-02-16 19:05:12,整体评价：比较容易沾灰，长度刚好，但是腰我穿上还是肥了
雨***8,颜色:56 橄榄色;尺码:170/80A/M,2021-02-16 18:14:28,穿着舒服，合身，性价比超高。
宁***雨,颜色:56 橄榄色;尺码:170/80A/M,2021-02-16 14:27:20,应该不错的。
李***东,颜色:32 深米色;尺码:175/88A/L,2021-02-16 12:35:26,很不错，儿子很喜欢。175，137斤左右，腰围有点儿大
o***8,颜色:32 深米色;尺码:170/80A/M,2021-02-16 09:17:10,好&hellip;&hellip;&hellip;&hellip;&hellip;
该***用,颜色:32 深米色;尺码:170/80A/M,2021-02-15 23:28:08,有点儿紧，腿粗星人止步哈
s***5,颜色:32 深米色;尺码:170/80A/M,2021-02-15 19:07:11,质量不错的，价格便宜的， 很实惠的。
刘***名,颜色:32 深米色;尺码:170/80A/M,2021-02-15 15:46:44,很好
雨***9,颜色:32 深米色;尺码:175/88A/L,2021-02-15 14:31:59,质量好，上身效果好
g***n,颜色:32 深米色;尺码:170/80A/M,2021-02-15 13:45:03,非常好，尺寸刚好！修身适合
w***6,颜色:56 橄榄色;尺码:175/88A/L,2021-02-15 00:10:54,"购买的东西已经收到了，商品质量确实非常的好，与卖家描述的完全一致，这个正是我想要的，可以说是非常满意,真的很喜欢，完全超出了最初的期望值，物流速度非常的快，包装也非常仔细、严实，快递小哥服务态度很好，运送速度很快，很满意的一次购物，给力！！"
坏***希,颜色:32 深米色;尺码:170/80A/M,2021-02-14 20:48:57,优衣库家的东西就不多说了，懂的都懂，等骨折时闭眼入就是了
菜***字,颜色:32 深米色;尺码:170/80A/M,2021-02-14 20:23:55,可以
宋***6,颜色:32 深米色;尺码:165/72A/S,2021-02-14 11:58:19,非常棒！
新***班,颜色:69 藏青色;尺码:170/80A/M,2021-02-14 11:16:15,此用户没有填写评论!
t***2,颜色:38 深褐色;尺码:165/72A/S,2021-02-14 10:28:22,裤头有绳绑，有弹力带，真心不错
t***2,颜色:69 藏青色;尺码:165/72A/S,2021-02-14 10:28:22,不错，有弹性，穿起来舒服
k***7,颜色:56 橄榄色;尺码:175/88A/L,2021-02-13 20:08:05,太好了
但***中,颜色:32 深米色;尺码:165/72A/S,2021-02-13 19:16:53,可以
天***0,颜色:32 深米色;尺码:170/80A/M,2021-02-13 19:10:31,好看，穿着也舒服。价格也超值。
t***4,颜色:69 藏青色;尺码:170/80A/M,2021-02-13 09:16:31,很棒的衣服，质量好，款式好！！！
w***u,颜色:32 深米色;尺码:170/80A/M,2021-02-13 07:55:41,一直在穿优衣库家的裤子，合身精干。
陈***g,颜色:56 橄榄色;尺码:175/88A/L,2021-02-12 22:48:30,质量非常好，与卖家描述的完全一致，非常满意，真的很喜欢，完全超出期望值，发货速度非常快，包装非常仔细、严实，物流公司服务态度很好，运送速度很快，很满意的一次购物。
c***8,颜色:56 橄榄色;尺码:170/80A/M,2021-02-12 22:20:28,给我弟买的，183，60kg，M码刚好。
t***6,颜色:56 橄榄色;尺码:165/72A/S,2021-02-12 13:11:34,裤子挺好看的 很有弹性版型也挺好看的
w***_,颜色:32 深米色;尺码:175/88A/L,2021-02-11 22:53:34,还没穿，99买不了吃亏买不了上当，先屯着
成***雨,颜色:56 橄榄色;尺码:180/96B/XL,2021-02-11 19:55:08,裤子质量非常好，版型也好，非常喜欢
w***u,颜色:38 深褐色;尺码:165/72A/S,2021-02-11 12:00:32,可以
陶***生,颜色:32 深米色;尺码:175/88A/L,2021-02-11 11:06:36,此用户没有填写评论!
l***牌,颜色:56 橄榄色;尺码:170/80A/M,2021-02-10 22:43:02,布料舒服，很厚实，很保暖，直筒版型很好看，颜色大方气质，腰围有设计弹力，还有松紧绳，包容性强。
l***3,颜色:32 深米色;尺码:175/88A/L,2021-02-10 16:29:39,不错，可以
h***x,颜色:32 深米色;尺码:175/88A/L,2021-02-10 16:22:44,优衣库的衣服和裤子真的值得购买，做工舒适度都很好！优衣库的衣服和裤子真的值得购买，做工舒适度都很好！优衣库的衣服和裤子真的值得购买，做工舒适度都很好！优衣库的衣服和裤子真的值得购买，做工舒适度都很好！
w***7,颜色:38 深褐色;尺码:170/80A/M,2021-02-10 15:27:48,买给老公，L码没买到，拍了两个颜色M码，打开快递还是有点忐忑，以为腰会小，谁知穿上正好，倒是意外之喜。他比较挑剔，这次竟然没挑三拣四，应该是喜欢的，毕竟优衣库的衣服，穿着还是很舒服的。他168/70，给大家做个参考。
w***7,颜色:56 橄榄色;尺码:170/80A/M,2021-02-10 15:27:48,买给老公，L码没买到，拍了两个颜色M码，打开快递还是有点忐忑，以为腰会小，谁知穿上正好，倒是意外之喜。他比较挑剔，这次竟然没挑三拣四，应该是喜欢的，毕竟优衣库的衣服，穿着还是很舒服的。他168/70，给大家做个参考。
蛋***挞,颜色:32 深米色;尺码:165/72A/S,2021-02-10 15:13:53,好看好看好看！
登***宴,颜色:32 深米色;尺码:165/72A/S,2021-02-10 13:10:31,还不错
可***8,颜色:56 橄榄色;尺码:170/80A/M,2021-02-10 11:08:22,整体评价：不小心买小了一号，但是老公说还行 上身效果：偏紧身的款 厚薄度：适合春秋天穿
t***7,颜色:56 橄榄色;尺码:165/72A/S,2021-02-10 09:58:41,基础款，贴身，修型，nice
h***4,颜色:56 橄榄色;尺码:170/80A/M,2021-02-10 09:40:08,不错，老公穿着好看
l***0,颜色:32 深米色;尺码:175/88A/L,2021-02-10 08:36:20,裤子不错，质量很好，170身高140斤  穿着正好
t***6,颜色:32 深米色;尺码:170/80A/M,2021-02-10 08:31:16,到手后感觉是店里的柜台样品or退换货重新打包发过来的，收货后商城就下架了。裤子洗后有色差、易起皱，比想象中薄，男款腰有点低。但是做工质量和穿着舒适度很棒，4折入手性价比不错。
最***林,颜色:38 深褐色;尺码:165/72A/S,2021-02-10 00:15:23,身高175体重63选了S码，非常性感，哈哈。弹力真的很足，拿来冬天搭配靴子。不过还是更推荐M啦，M的话裤脚会长些，我选了S就懒得改裤脚了
初***x,颜色:32 深米色;尺码:170/80A/M,2021-02-09 22:42:54,这个颜色现在穿难搭衣服，不是很好看
初***x,颜色:69 藏青色;尺码:170/80A/M,2021-02-09 22:42:19,买给弟弟的，原来买的149，刚收到两天就降价了，不给退差价，重新拍了条，把149的退回去了
越***啦,颜色:32 深米色;尺码:170/80A/M,2021-02-09 20:08:54,173/60 刚好，裤头要扎皮带
j***p,颜色:38 深褐色;尺码:165/72A/S,2021-02-09 20:00:06,整体评价：不错 上身效果：比较贴身 尺码推荐：167高53重，腰围长度都刚好 厚薄度：厚度适中，适合秋冬穿
t***0,颜色:56 橄榄色;尺码:170/80A/M,2021-02-09 18:27:27,听闻远方有你  动身跋涉千里
t***0,颜色:32 深米色;尺码:170/80A/M,2021-02-09 18:26:57,听闻远方有你  动身跋涉千里
蛋***白,颜色:56 橄榄色;尺码:170/80A/M,2021-02-09 15:26:37,非常nice
t***1,颜色:32 深米色;尺码:165/72A/S,2021-02-09 13:04:09,很喜欢这条裤子很舒适
小***迪,颜色:32 深米色;尺码:170/80A/M,2021-02-09 09:11:48,很好，挺舒服的。
女***7,颜色:32 深米色;尺码:170/80A/M,2021-02-09 08:55:11,非常好，性价比较高，码数非常合适，老公很喜欢，这次网购很愉快，大赞👍
u***k,颜色:32 深米色;尺码:165/72A/S,2021-02-09 00:29:13,还可以，不错
l***i,颜色:56 橄榄色;尺码:175/88A/L,2021-02-08 21:02:57,老公挺喜欢的，他喜欢就好
毓***车,颜色:32 深米色;尺码:165/72A/S,2021-02-08 20:53:39,超级舒服
海***我,颜色:38 深褐色;尺码:170/80A/M,2021-02-08 20:21:29,合适
l***o,颜色:56 橄榄色;尺码:165/72A/S,2021-02-08 20:05:38,紧身尺码
t***4,颜色:38 深褐色;尺码:165/72A/S,2021-02-08 19:40:32,女162、55穿着合适，除了腰有点大之外
十***天,颜色:32 深米色;尺码:165/72A/S,2021-02-08 17:02:24,买多少次差评多少次，一直买一直差评，无论什么衣服。 因为我一直买客服一直没回复过 只要有一个问题就是永远联系不上客服 都要等客服有时间 因为这个我淘宝要开声音不错过任何一次呼唤 真的绝了，所以我决定买一次差评一次 太失望了，真爱优衣库，客服真一言难尽
桃***0,颜色:38 深褐色;尺码:170/80A/M,2021-02-08 15:31:12,买过多次，质量非常好，与卖家描述的完全一致，非常满意，真的很喜欢，完全超出期望值，发货速度非常快，包装非常仔细、严实，物流公司服务态度很好，运送速度很快，很满意的一次购物。
i***北,颜色:69 藏青色;尺码:175/88A/L,2021-02-08 11:19:11,此用户没有填写评论!
z***9,颜色:32 深米色;尺码:170/80A/M,2021-02-08 11:08:00,上身效果很好，面料微弹，修身显腿长。
z***9,颜色:56 橄榄色;尺码:170/80A/M,2021-02-08 11:08:00,上身效果很好，修身显腿长。超值！
b***章,颜色:56 橄榄色;尺码:175/88A/L,2021-02-07 22:03:40,给俺爸买过，这次给俺弟买！
米***8,颜色:56 橄榄色;尺码:170/80A/M,2021-02-07 21:09:43,好评！
t***9,颜色:69 藏青色;尺码:170/80A/M,2021-02-07 20:13:00,整体评价：一般 材质特性：一般 上身效果：一般 尺码推荐：一般 厚薄度：一般
t***9,颜色:38 深褐色;尺码:170/80A/M,2021-02-07 20:13:00,一般
f***n,颜色:69 藏青色;尺码:165/72A/S,2021-02-07 19:32:33,买小了，紧身的很，不过面料弹性很足，可以穿。
下***屋,颜色:56 橄榄色;尺码:180/96B/XL,2021-02-07 17:38:46,优衣库的东西真是物美价廉，非常好
石***m,颜色:56 橄榄色;尺码:175/88A/L,2021-02-07 17:07:06,裤子不错，有弹性。
t***5,颜色:32 深米色;尺码:170/80A/M,2021-02-07 13:24:56,裤子是修身版的，有弹力，深米色好看
t***5,颜色:38 深褐色;尺码:175/88A/L,2021-02-07 13:06:34,修身款式，面料有弹性，现在穿着挺暖和，挡风
车***3,颜色:32 深米色;尺码:170/80A/M,2021-02-07 12:46:44,终于收到我需要的宝贝了，东西很好，价美物廉，谢谢掌柜的!说实在，这是我淘宝购物来让我最满意的一次购物。无论是掌柜的态度还是对物品，我都非常满意的。掌柜态度很专业热情，有问必答，回复也很快，我问了不少问题，他都不觉得烦，都会认真回答我，这点我向掌柜表示由衷的敬意，这样的好掌柜可不多。  再说宝贝，正是我需要的，收到的时候包装完整，打开后让我惊喜的是，宝贝比我想象中的还要好!不得不得竖起大拇指。下次需要的时候我还会再来的，到时候麻烦掌柜给个优惠哦!
l***2,颜色:32 深米色;尺码:170/80A/M,2021-02-07 12:17:18,质量不错
小***g,颜色:32 深米色;尺码:170/80A/M,2021-02-07 11:48:04,很不错的一条裤子，性价比很高
t***9,颜色:69 藏青色;尺码:170/80A/M,2021-02-07 11:34:09,裤子是牛仔裤款式的，偏紧修身，偏薄吧，还软的，还不错的。
c***n,颜色:38 深褐色;尺码:165/72A/S,2021-02-07 00:17:34,优衣库就是好，
a***4,颜色:32 深米色;尺码:165/72A/S,2021-02-06 22:44:44,裤子挺好的 全新很满意，买的高领打底衫不满意，都是旧的，吊牌都发黄了
g***6,颜色:69 藏青色;尺码:165/72A/S,2021-02-06 22:23:39,买的第二条灯芯绒了，初冬单穿完全没问题，腰部松紧带做大幅度动作也没问题，总之很舒服
欧***2,颜色:32 深米色;尺码:165/72A/S,2021-02-06 19:17:08,很好！！！
桂***3,颜色:32 深米色;尺码:170/80A/M,2021-02-06 18:29:10,上身效果很好
c***7,颜色:32 深米色;尺码:170/80A/M,2021-02-06 14:58:01,身高180，体重72公斤，腰围81，穿M腰围正好合适，裤长略短，穿高帮运动鞋正好。物流发的EMS，过程很迷幻，反复折腾了一个星期。
c***6,颜色:32 深米色;尺码:180/96B/XL,2021-02-06 11:35:33,终于收到货了，非常非常喜欢，做工精致漂亮！跟我在实体店买的一模一样！还是一样的好用，开心五星好评，非常好！想不到那么快就到了！
疫***深,颜色:56 橄榄色;尺码:180/96B/XL,2021-02-06 09:16:11,东西不错，摸起来可以，想买黑色的，但是没有橄榄绿感觉还是有点不太合适
t***2,颜色:38 深褐色;尺码:170/80A/M,2021-02-06 00:37:45,170，136斤，非常合身，穿着很舒服，比牛仔裤舒服多了
m***6,颜色:32 深米色;尺码:170/80A/M,2021-02-06 00:23:47,优衣库信得过的产品，性价比高！
4***的,颜色:56 橄榄色;尺码:180/96B/XL,2021-02-05 22:47:35,老公喜欢
y***1,颜色:69 藏青色;尺码:165/72A/S,2021-02-05 17:42:52,还可以😊
两***虫,颜色:32 深米色;尺码:170/80A/M,2021-02-05 15:23:04,东西质量还可以，快递速度也很给力
k***n,颜色:56 橄榄色;尺码:170/80A/M,2021-02-05 14:18:02,很好👍
沙***6,颜色:32 深米色;尺码:170/80A/M,2021-02-05 12:22:03,"质量非常好，与卖家描述的完全一致，非常满意,真的很喜欢，完全超出期望值，发货速度非常快，包装非常仔细、严实，物流公司服务态度很好，运送速度很快，很满意的一次购物"
箜***响,颜色:38 深褐色;尺码:165/72A/S,2021-02-05 00:40:31,断码特价，实惠
z***9,颜色:38 深褐色;尺码:170/80A/M,2021-02-05 00:31:44,一般般
小***0,颜色:32 深米色;尺码:170/80A/M,2021-02-04 22:59:49,尺码偏小
空***威,颜色:32 深米色;尺码:165/72A/S,2021-02-04 22:09:31,很好
1***星,颜色:56 橄榄色;尺码:175/88A/L,2021-02-04 22:03:47,老公满意
j***n,颜色:32 深米色;尺码:165/72A/S,2021-02-04 21:48:26,挺好 复古 百搭 要是裆部再长一点就好
f***e,颜色:32 深米色;尺码:165/72A/S,2021-02-04 21:09:50,质量不错，价格很划算
f***e,颜色:69 藏青色;尺码:165/72A/S,2021-02-04 21:09:26,质量很好，这个价格很划算
j***s,颜色:32 深米色;尺码:170/80A/M,2021-02-04 20:06:42,喜欢的品牌满意
w***o,颜色:56 橄榄色;尺码:170/80A/M,2021-02-04 19:13:04,好评。
m***u,颜色:38 深褐色;尺码:175/88A/L,2021-02-04 17:48:32,买这条裤子开始是因为好看和便宜，后来是因为要给工号111451这位客服专门来个差评，因为她不止一次跟我强调了她的工号，无所畏惧的态度充分展示了她觉得她自己是老娘她很忙没空管你，回复的效率和态度表明一切，反正不会管你怎么样，想买就乖乖下单，想吵老娘忙得很没空管你。就是这么拽，这个差评是给你的，工号111451，谢谢！
w***0,颜色:56 橄榄色;尺码:170/80A/M,2021-02-04 17:42:10,质量很好 穿着舒适
z***0,颜色:32 深米色;尺码:170/80A/M,2021-02-04 16:22:17,很好，有弹性
许***6,颜色:32 深米色;尺码:180/96B/XL,2021-02-04 16:05:16,质量不错，价格便宜。
星***j,颜色:32 深米色;尺码:170/80A/M,2021-02-04 14:08:08,优惠买的 还可以吧 希望自己帅点陪他😓
b***e,颜色:69 藏青色;尺码:165/72A/S,2021-02-04 14:03:37,上身效果：好 厚薄度：中 尺码推荐：115左右这个码刚好 整体评价：好
g***8,颜色:32 深米色;尺码:175/88A/L,2021-02-04 13:20:31,已经收到啦，很不错，性价比高
k***2,颜色:32 深米色;尺码:170/80A/M,2021-02-04 13:08:39,等了个好价格，偏紧审，可以不包邮
迎***雪,颜色:38 深褐色;尺码:170/80A/M,2021-02-04 10:35:18,弹性面料，修身款，厚薄适中，175cm/57kg穿M码宽松，之前买了s的修身，里面不能穿秋裤退了。外包装不知弄到什么，搞裤子也一股味，好在没弄破包装搞烂裤子，不影响穿着。
猫***素,颜色:38 深褐色;尺码:165/72A/S,2021-02-04 10:17:20,优衣库的男裤太适合我这种腰细腿粗的人了，尺寸合适得不得了！！！完美！！另：我是女滴，身高172，体重60公斤
c***z,颜色:56 橄榄色;尺码:170/80A/M,2021-02-04 10:03:30,送货速度快，东西好，喜欢
c***z,颜色:32 深米色;尺码:170/80A/M,2021-02-04 10:03:30,送货速度快，东西好，喜欢
瓜***才,颜色:32 深米色;尺码:165/72A/S,2021-02-03 23:52:25,买的囤货  非常喜欢
e***t,颜色:32 深米色;尺码:180/96B/XL,2021-02-03 23:45:37,很好。。
c***5,颜色:32 深米色;尺码:180/96B/XL,2021-02-03 23:08:37,好
我***妮,颜色:69 藏青色;尺码:165/72A/S,2021-02-03 20:49:58,厚实，就是容易沾灰。修身
袁***3,颜色:32 深米色;尺码:170/80A/M,2021-02-03 20:37:58,很好很好很好
x***4,颜色:38 深褐色;尺码:175/88A/L,2021-02-03 19:55:57,很满意这条裤子，就是略显紧身，太胖了就不能穿了
h***s,颜色:32 深米色;尺码:170/80A/M,2021-02-03 18:46:08,价廉物美，尺码合适，超级喜欢
h***0,颜色:32 深米色;尺码:180/96B/XL,2021-02-03 18:27:20,弹性很足，很舒适，搞活动买的，性价比很高。
米***子,颜色:69 藏青色;尺码:165/72A/S,2021-02-03 17:51:23,这价格跌的也太快了吧
米***子,颜色:32 深米色;尺码:165/72A/S,2021-02-03 17:51:23,这价格跌的也太快了吧
岭***8,颜色:69 藏青色;尺码:165/72A/S,2021-02-03 17:35:36,量身一样合适。性价比高。
n***8,颜色:56 橄榄色;尺码:180/96B/XL,2021-02-03 17:22:11,质量很好，不错！
独***8,颜色:32 深米色;尺码:170/80A/M,2021-02-03 17:10:06,好评
g***e,颜色:56 橄榄色;尺码:170/80A/M,2021-02-03 15:01:58,上身效果：舒适保暖，延展性好 尺码推荐：170 135穿M码正好，虽然是紧身款但不紧绷 厚薄度：中等厚度，单穿春秋天没问题 整体评价：99入手很值了，墨绿色很好看
l***8,颜色:69 藏青色;尺码:170/80A/M,2021-02-03 13:54:15,有点窄，总体不错
l***6,颜色:32 深米色;尺码:180/96B/XL,2021-02-03 13:15:38,蛮好
w***4,颜色:56 橄榄色;尺码:180/96B/XL,2021-02-03 13:05:29,弹力大，紧身版型
白***8,颜色:32 深米色;尺码:180/96B/XL,2021-02-03 12:09:41,🌵值得购买！没有什么味道，用起来还可以😘，没有不舒服的地方😶，所以我还蛮喜欢的
k***8,颜色:69 藏青色;尺码:165/72A/S,2021-02-03 11:56:49,买的当女款穿，不错
u***6,颜色:32 深米色;尺码:170/80A/M,2021-02-03 11:39:49,好看，穿着舒服。带弹力的 材质特性：灯芯绒 面料品质：98%棉2%氨纶，混纺酥服啊
终***心,颜色:69 藏青色;尺码:170/80A/M,2021-02-03 11:22:58,很好穿，很舒服，好评
8***妈,颜色:32 深米色;尺码:170/80A/M,2021-02-03 10:41:05,好好好好好好好好好好好好好好好好好好好好好好好好好好好好好好好好好好好好好好好好好好好好好好好好好好好好好好好好好好好好好好好好好好好好好好好好好好好好好好好好好好好。
t***0,颜色:56 橄榄色;尺码:170/80A/M,2021-02-03 08:47:39,还可以之前买了一条，这次降价了再买一条
t***4,颜色:32 深米色;尺码:175/88A/L,2021-02-03 00:58:23,大腿位置有点紧，整体还可以。
t***t,颜色:69 藏青色;尺码:165/72A/S,2021-02-02 21:49:50,灯芯绒太粘毛
秋***6,颜色:32 深米色;尺码:180/96B/XL,2021-02-02 20:40:39,裤子完美，无论是颜色还是酷刑质量都很好，价格还亲民，还会再来
t***2,颜色:56 橄榄色;尺码:175/88A/L,2021-02-02 18:50:34,178，73kg穿起来刚好，显瘦
恰***笑,颜色:69 藏青色;尺码:170/80A/M,2021-02-02 18:11:55,整体评价：99绝对值 材质特性：比较贴身 属于修身紧身款 不过有弹性 所以不会不舒服 上身效果：显得腿细  尺码推荐：因为有弹性 所以按照平时尺码买就行  厚薄度：中等厚度 春秋穿最合适吧 面料品质：灯芯绒比较柔软 深色会稍微有点粘灰 但不严重
纯***子,颜色:69 藏青色;尺码:165/72A/S,2021-02-02 18:01:27,正品，买的放心，价钱也公道，满意！挺好的，和想象中一样，随意搭都很好看，满意！质量很好哦，发货也很快，一家非常喜欢的店铺，我要疯狂推荐给朋友们
逸***7,颜色:56 橄榄色;尺码:175/88A/L,2021-02-02 17:10:05,收到裤子有瑕疵客服永远忙半小时小时来句自动回复打客服只有语音解答 只有平台最后合理解决
w***g,颜色:56 橄榄色;尺码:170/80A/M,2021-02-02 16:51:24,快递很快，顺丰包邮，原来是149的，看到有活动99多买了两条，穿起来舒服，不错👍，棒棒的
w***g,颜色:32 深米色;尺码:170/80A/M,2021-02-02 16:51:23,此用户没有填写评论!
大***榜,颜色:38 深褐色;尺码:170/80A/M,2021-02-02 16:40:37,还可以就是面料有一点点硬
大***榜,颜色:56 橄榄色;尺码:170/80A/M,2021-02-02 16:39:16,还可以就是面料有一点点硬
杨***的,颜色:56 橄榄色;尺码:175/88A/L,2021-02-02 15:45:06,冬季里面加条秋裤棉裤，腰围合身，挺好看的
s***9,颜色:32 深米色;尺码:165/72A/S,2021-02-02 14:09:59,挺好的 快递很快
t***9,颜色:32 深米色;尺码:165/72A/S,2021-02-02 13:32:50,此用户没有填写评论!
树***船,颜色:38 深褐色;尺码:170/80A/M,2021-02-02 12:42:39,紧身，保暖效果不错。
w***阳,颜色:32 深米色;尺码:165/72A/S,2021-02-02 12:01:47,质量不错，穿上也合适
s***叶,颜色:38 深褐色;尺码:170/80A/M,2021-02-02 10:30:34,挺合适的，老爸说刚好
哆***梦,颜色:32 深米色;尺码:165/72A/S,2021-02-02 09:24:49,裤子很舒服 太划算了
t***4,颜色:38 深褐色;尺码:165/72A/S,2021-02-02 09:08:16,弹性十足
t***7,颜色:32 深米色;尺码:175/88A/L,2021-02-02 08:58:38,非常好
z***7,颜色:38 深褐色;尺码:170/80A/M,2021-02-02 07:19:19,好。身高173.体重148刚好
t***2,颜色:56 橄榄色;尺码:180/96B/XL,2021-02-01 23:32:08,整体评价：类似于牛仔裤，版型挺好的 材质特性：灯芯绒加棉材质 上身效果：挺舒服的好看 尺码推荐：身高178，体重80公斤，穿这个型号的有点大了，应该买88a的
