displayUserNick,auctionSku,rateDate,rateContent
k***u,颜色:69 藏青色;尺码:165/76A,2021-01-29 22:00:01,非常棒，这个买了不后悔
楠***几,颜色:69 藏青色;尺码:175/86A,2021-01-23 10:27:39,腰围奇怪，轻磅，皮牌弄个更好
x***c,颜色:69 藏青色;尺码:175/84A,2021-01-20 19:55:00,买了一条82的，套棉裤有点紧，又买了跳84的，安逸了
h***7,颜色:69 藏青色;尺码:165/76A,2021-01-14 11:09:17,东西很OK，一直都会买的单品，就是裤长对我不是很友好，170/60入这款s码即可。
大***球,颜色:69 藏青色;尺码:165/76A,2021-01-14 10:12:45,奈斯
空***言,颜色:69 藏青色;尺码:170/82A,2021-01-09 23:31:13,很好啊，男朋友喜欢
购***捷,颜色:69 藏青色;尺码:165/76A,2021-01-04 08:50:38,跟以前穿的做了对比。以为是软的，拿到后发现也是硬的，原色，像是挂了一层浆，硬挺。产地不一样。
z***l,颜色:69 藏青色;尺码:160/70A,2021-01-01 11:35:50,整体评价：非常非常满意 材质特性：标签上注明是棉的 尺码推荐：173cm60kg买的160/70A很合适，详情页里的尺码很标准 上身效果：直筒牛仔裤很喜欢
t***5,颜色:69 藏青色;尺码:165/76A,2020-12-28 20:29:15,马马虎虎
h***8,颜色:69 藏青色;尺码:170/78A,2020-12-24 17:39:02,挺好看的，中意。板型很棒。
x***c,颜色:69 藏青色;尺码:170/82A,2020-12-23 19:51:10,此款裤子腰围小两个码，标的87的腰围实际只有82，本来准备冬天套棉裤穿，现在只有等天热单穿了&hellip;&hellip;
风***儿,颜色:69 藏青色;尺码:170/82A,2020-12-21 21:23:00,面料硬挺，有型，量好腰围臀围买的，剪了裤脚正好合适，还没洗过 有赤耳，ykk 拉链，带自锁功能，口袋边角加固，缝线整齐，性价比很高
落***g,颜色:69 藏青色;尺码:175/86A,2020-12-20 11:44:07,版型直筒，颜色也不错
2***鹏,颜色:69 藏青色;尺码:165/76A,2020-12-12 12:20:26,刚拿到快递，一看宝贝都下架了，哈哈可能是最后几件了。300买到不亏，
d***6,颜色:69 藏青色;尺码:165/76A,2020-12-12 10:50:50,质量不错，就是今年活动力度不大呢
p***t,颜色:69 藏青色;尺码:165/74A,2020-12-09 12:02:05,版型偏大。整体质量很好。退换货速度也很快。
何***p,颜色:69 藏青色;尺码:170/82A,2020-12-08 02:05:54,整体评价：这款牛仔裤我想了一个月才买，因为我在实体店买了修身弹力原色牛仔裤，直筒才是我的菜，裤子是孟加拉出厂的，不知道和国内生产有什么区别，优衣库实体店买裤子不少，第一条裤子是不需要改裤脚我是很意外的！非常喜欢。实体店这款我问过也是说没有这款牛仔裤 尺码推荐：我176cm，170/82A是实体店试出来的 厚薄度：广东四季款，非常适合。
寺***克,颜色:69 藏青色;尺码:170/82A,2020-12-07 17:55:47,今年的神裤和传统直筒都是秋冬春季通勤佳品， 不能和其他品牌的原牛比较，都是一条好裤子， 十年前穿28-29，现在穿31-32的在此地留言， (ಥ_ಥ)
t***2,颜色:69 藏青色;尺码:175/86A,2020-12-07 09:39:16,还可以，挺舒服的，宽松
j***7,颜色:69 藏青色;尺码:165/74A,2020-12-03 23:57:04,难得这么合适的，还有赤耳，满意
梦***青,颜色:69 藏青色;尺码:175/86A,2020-12-02 19:22:54,还不错，有点硬，但不易皱，比较暖和，适合冬季穿
s***5,颜色:69 藏青色;尺码:170/82A,2020-11-30 13:47:31,随便试试吧，还没穿，应该没啥问题
无***黑,颜色:69 藏青色;尺码:180/90B,2020-11-30 12:02:10,宝贝很好 可惜太小  想换没货  想退不给  客服绕圈  2H太极  申请退货  审核不过  差评警告  怕被骚扰 所以想想  还是中评 望客服们 多多学习 多多识字 少学马保国！
研***e,颜色:69 藏青色;尺码:170/82A,2020-11-29 22:27:00,此用户没有填写评论!
1***n,颜色:69 藏青色;尺码:170/78A,2020-11-25 09:21:20,裤子不错，人工很差！
c***l,颜色:69 藏青色;尺码:170/82A,2020-11-24 08:30:21,原牛，比设计师合作款直筒修身，除了腰围比通常直筒裤也小两个号，换了一次了就讲究穿吧
魂***语,颜色:69 藏青色;尺码:175/86A,2020-11-23 18:38:17,挺好的也很合身当轻磅牛来穿把，以前知道优衣库有原牛，这次很巧买到贝原版的
贝***哼,颜色:69 藏青色;尺码:180/90B,2020-11-18 12:28:57,得劲
清***2,颜色:69 藏青色;尺码:170/82A,2020-11-18 07:42:02,第二次买了，囤一条
郭***火,颜色:69 藏青色;尺码:165/74A,2020-11-16 18:58:29,很好，合身，比修身的原色要宽松，是直筒裤，稍微高腰，膝盖不紧绷，臀部也不紧
n***i,颜色:69 藏青色;尺码:165/74A,2020-11-12 13:32:36,已经拿去剪裤脚的路上了
清***2,颜色:69 藏青色;尺码:175/84A,2020-10-27 07:56:03,1.79，72穿33稍大，宽松点舒服
t***7,颜色:69 藏青色;尺码:180/96B,2020-10-20 23:39:07,大品牌质量杠杠的，老顾客了
叶***绊,颜色:69 藏青色;尺码:170/78A,2020-10-18 11:47:00,还行吧 相信优衣库
袁***t,颜色:69 藏青色;尺码:170/82A,2020-10-16 13:04:54,裤子版型不错，可以遮盖腿型缺陷，腰有点肥。面料很硬，一般舒适。
l***1,颜色:69 藏青色;尺码:170/82A,2020-10-16 12:59:47,原牛不错，是我想要的的。
c***7,颜色:69 藏青色;尺码:170/82A,2020-10-13 14:52:55,终于买到一条合适的，好难抢啊
c***7,颜色:69 藏青色;尺码:175/86A,2020-10-11 19:32:06,买大了，客服非常好，就是电话很难打进去
张***呀,颜色:69 藏青色;尺码:170/78A,2020-10-07 10:27:46,辣鸡优衣库，我申请退货，包裹都已经寄出，10月3号就已经签收了，结果昨天晚上突然说没有收到货，还说是空白过，拒绝退款。售后太垃圾了，四天是不是把我退回的衣服给弄丢了，找人工服务全是机器人。消费者的权益也太难维护了，我这边咨询了物流，都是正常寄出没有问题，并且我也是给妈妈买了衣服，结果尺码不合适才退货的，没有任何问题，结果优衣库把退货签收了，又拒绝退款，找人工还找不到。太气氛了，作为优衣库的老粉真的很无奈
d***o,颜色:69 藏青色;尺码:180/90B,2020-10-05 01:24:55,好东西，接近完美。 缝制工艺整齐出色，难得一见的直桶原色。买了两条
陈***5,颜色:69 藏青色;尺码:160/70A,2020-10-04 20:26:28,有些掉色可以理解，就是洗过一次怎么这么皱，烫也烫不平，裤长是真的长
a***1,颜色:69 藏青色;尺码:160/70A,2020-10-03 19:44:43,走线工整，做工精细，薄一些，没别的问题，穿着舒服
t***2,颜色:69 藏青色;尺码:175/84A,2020-09-29 17:21:47,做工精致，版型非常好
j***e,颜色:69 藏青色;尺码:175/86A,2020-09-23 14:15:34,好评。
湘***2,颜色:69 藏青色;尺码:175/84A,2020-09-18 14:45:38,客服太垃圾了 效率太差
t***6,颜色:69 藏青色;尺码:170/82A,2020-09-17 23:47:31,穿着还不错
z***3,颜色:69 藏青色;尺码:165/76A,2020-09-17 21:00:07,直筒原牛，版型不错。
y***s,颜色:69 藏青色;尺码:165/76A,2020-09-16 14:07:54,此用户没有填写评论!
街***察,颜色:69 藏青色;尺码:170/82A,2020-09-14 12:10:36,优衣库的这条裤子秒杀五百内的原牛
a***s,颜色:69 藏青色;尺码:170/82A,2020-09-12 19:54:17,裤子材质实在太硬了 我的**太大 穿着给我咯得疼了好久
s***c,颜色:69 藏青色;尺码:165/76A,2020-09-12 15:50:47,此用户没有填写评论!
p***0,颜色:69 藏青色;尺码:180/96B,2020-09-04 07:14:45,整体评价：一如既往的好
1***e,颜色:69 藏青色;尺码:175/86A,2020-09-01 00:09:36,此用户没有填写评论!
闽***海,颜色:69 藏青色;尺码:175/88A,2020-08-31 21:57:50,有点硬
t***0,颜色:69 藏青色;尺码:165/76A,2020-08-28 11:05:34,不太爱评价，但这个是真的棒！质量很好，做工细致，包裹很严实，快递服务态度好，绝对好评！
柠***1,颜色:69 藏青色;尺码:175/88A,2020-08-24 13:41:49,挺好
t***4,颜色:69 藏青色;尺码:170/78A,2020-08-22 00:12:03,帅就完了
敲***的,颜色:69 藏青色;尺码:165/72A,2020-08-18 16:18:27,整体评价：优衣库终于意识到亚洲人不都是巨人了。有两个错误，原色写成了水洗，标签74A写成了72A。 材质特性：说是水洗，其实是原牛，赤耳包边。 上身效果：看图片 尺码推荐：本人净身高176cm，体重58kg，李维斯stf穿w30l32，这条165/72A，标签显示是74A。 厚薄度：秋冬穿 面料品质：品质很好
湖***子,颜色:69 藏青色;尺码:170/78A,2020-08-17 21:47:02,一直购买优家的衣服，从没让我失望过。很喜欢直筒牛仔裤这次一次购入2条换着穿。
龙***r,颜色:69 藏青色;尺码:175/88A,2020-08-17 15:06:12,挺好&hellip;
蓝***5,颜色:69 藏青色;尺码:170/82A,2020-08-17 14:43:37,不错 很喜欢
n***n,颜色:69 藏青色;尺码:175/84A,2020-08-16 14:41:47,面料扎实
b***0,颜色:69 藏青色;尺码:175/86A,2020-08-15 17:09:16,好硬的裤子
z***3,颜色:69 藏青色;尺码:160/68A,2020-08-11 20:55:14,裤子太硬了
t***9,颜色:69 藏青色;尺码:170/82A,2020-07-31 16:05:22,此用户没有填写评论!
