displayUserNick,auctionSku,rateDate,rateContent
s***t,颜色分类:67 海蓝色;尺寸:160/66A,2020-12-13 13:01:38,本身腿不直，这款一点不显，160，104斤66A里面套个绒裤冬天穿正好，弹力很大，打算再买个其他颜色
胡***y,颜色分类:65 宝蓝色;尺寸:160/68A,2020-12-13 12:32:56,good
k***0,颜色分类:67 海蓝色;尺寸:160/66A,2020-12-13 11:28:01,质感很好，舒服！这厚度秋天穿刚好
好***m,颜色分类:65 宝蓝色;尺寸:150/58A,2020-12-13 02:41:23,穿上长度确实是九分。腰刚刚好再胖一点就提不上去了😱
a***e,颜色分类:65 宝蓝色;尺寸:160/66A,2020-12-12 22:27:44,好
s***1,颜色分类:65 宝蓝色;尺寸:160/64A,2020-12-12 21:58:33,版型真的是超赞，在实体店试穿的时候还没有活动价，看到双十二有活动，果断买了，腰围有点大，选小1码，裤子很有弹力
l***p,颜色分类:09 黑色;尺寸:155/62A,2020-12-12 21:21:36,平时26牛仔裤，这个62A差不多正好，吃饱饭也不会紧那种 然后裤腿不算很紧身的，里面可以加打底的
细***4,颜色分类:65 宝蓝色;尺寸:150/56A,2020-12-12 19:33:59,尺码推荐：158，42。 整体评价：非常好，实体店买过几条了，现在网上优惠。
t***星,颜色分类:67 海蓝色;尺寸:150/58A,2020-12-12 18:23:41,版型一般 弹力一般
车***c,颜色分类:09 黑色;尺寸:155/62A,2020-12-12 15:22:31,整体评价：版型好，买了三件不同颜色，深蓝好看，这个黑色有点发白的那种，不怎么喜欢 尺码推荐：158，50KG 厚薄度：中等候，适合初冬 上身效果：很好，适合小短腿
t***1,颜色分类:67 海蓝色;尺寸:160/64A,2020-12-12 14:07:46,此用户没有填写评论!
那***5,颜色分类:65 宝蓝色;尺寸:160/68A,2020-12-12 10:31:12,裤子版型很好，好看
w***6,颜色分类:09 黑色;尺寸:155/62A,2020-12-12 08:02:19,相信优衣库
s***3,颜色分类:65 宝蓝色;尺寸:155/62A,2020-12-11 21:43:46,这条九分裤裤型真的很不错，先买的青灰色很好看，然后又买了黑色，黑色略微硬，而且爱粘毛，趁双十二又买了宝蓝色，好像更柔软一些！
寻***y,颜色分类:09 黑色;尺寸:155/62A,2020-12-11 18:41:08,此用户没有填写评论!
6***0,颜色分类:67 海蓝色;尺寸:160/68A,2020-12-11 15:24:18,尺码偏小有点紧，没那么合适
