displayUserNick,auctionSku,rateDate,rateContent
c***4,颜色分类:02 浅灰色;尺寸:155/62A,2021-02-20 20:10:59,宝贝收到了，很惊喜，质量非常好，很满意的一次购物。我会继续回购的，店家值得信赖完美，产品很惊艳，性价比合适，希望用的长久！从没想过这么实惠的价格能买到这么好的宝贝，下次还来你家终于买到满意的商品了，超出期望，非常喜欢，身边的人都问我要链接正品，买的放心，价钱也公道，满意！👌从没想过这么实惠的价格，😴能买到这么好的宝贝，😃性价比非常高，我很喜欢哦😃质量挺好，物流也很快，赞！
s***f,颜色分类:02 浅灰色;尺寸:155/62A,2021-02-20 16:49:29,还不错，吃多了的话会显小肚子
2***师,颜色分类:02 浅灰色;尺寸:155/64A,2021-02-19 14:27:50,此用户没有填写评论!
阴***梅,颜色分类:02 浅灰色;尺寸:150/58A,2021-02-18 19:24:41,颜色布料均好，合身
f***0,颜色分类:02 浅灰色;尺寸:155/64A,2021-02-09 10:24:22,大小合适
