displayUserNick,auctionSku,rateDate,rateContent
u***我,颜色分类:09 黑色;尺码:160/84A/M,2021-02-06 06:38:45,这上衣很不错，买了两件，超级舒服的
温***6,颜色分类:17 枣红色;尺码:160/84A/M,2021-02-06 00:35:24,打折优惠，穿着舒适。
文***笋,颜色分类:09 黑色;尺码:160/84A/M,2021-02-06 00:11:19,oooooooooooook
e***y,颜色分类:01 乳白色;尺码:155/80A/S,2021-02-05 22:55:21,不好意思，确认晚了，产品收到了，包装挺好的，很多次购买了 还是一如既往的好 很开心 物流也还不错。看上去很实在很满意，质量很好。很不错的一次购物，与卖家描述的一模一样。
e***y,颜色分类:38 深褐色;尺码:155/80A/S,2021-02-05 22:53:36,柔软舒适不好意思，确认晚了，产品收到了，包装挺好的，很多次购买了 还是一如既往的好 很开心 物流也还不错。看上去很实在很满意，质量很好。很不错的一次购物，与卖家描述的一模一样。
7***林,颜色分类:01 乳白色;尺码:170/100B/XXL,2021-02-05 22:40:57,东西质量非常好，与卖家描述的完全一致，非常满意正品，买的放心，价钱也公道，满意！是理想中的产品，质量不错，物流也很快，值得点赞
凝***雪,颜色分类:11 粉红色;尺码:170/100B/XXL,2021-02-05 22:14:24,衣服不错，面料特别舒服
平***w,颜色分类:17 枣红色;尺码:160/84A/M,2021-02-05 21:57:20,价廉物美，喜欢，好看，颜色亮。
b***1,颜色分类:01 乳白色;尺码:170/100B/XXL,2021-02-05 21:38:14,挺容易起球，买大了
古***泉,颜色分类:09 黑色;尺码:155/80A/S,2021-02-05 21:11:27,百搭好穿，155的尺码衣服肩宽平铺38，上身效果不错，脖子那略紧了点
t***9,颜色分类:09 黑色;尺码:155/80A/S,2021-02-05 21:06:06,黑色百搭，这个同款买了三件，还买了酒红色和粉色都很好看，面料非常舒服，1米62 49公斤，买的S号挺合适的，打底和外穿都可以。
t***9,颜色分类:11 粉红色;尺码:155/80A/S,2021-02-05 21:05:03,这款打底面料很舒服，袖子有一点设计感，所以外穿也没有问题，领子虽然有点高，但是不会勒脖子，这个颜色很好看，很衬肤色，同款买了三件。1米62 49公斤，买的S号刚好合适，有点宽松。
i***c,颜色分类:02 浅灰色;尺码:160/88A/L,2021-02-05 19:53:47,好看！很柔软
兔***仔,颜色分类:38 深褐色;尺码:160/84A/M,2021-02-05 19:10:40,这个颜色很好看哦
兔***仔,颜色分类:08 深灰色;尺码:160/84A/M,2021-02-05 19:10:28,软软的很舒服
l***9,颜色分类:02 浅灰色;尺码:165/92A/XL,2021-02-05 16:56:03,很不错。
e***8,颜色分类:11 粉红色;尺码:160/84A/M,2021-02-05 15:31:06,一如既往地好
亦***凡,颜色分类:01 乳白色;尺码:165/92A/XL,2021-02-05 14:16:52,打底穿着舒服
b***i,颜色分类:01 乳白色;尺码:170/100B/XXL,2021-02-05 14:06:55,不错
陈***v,颜色分类:11 粉红色;尺码:160/88A/L,2021-02-05 13:48:39,收到
陈***v,颜色分类:02 浅灰色;尺码:160/88A/L,2021-02-05 13:48:39,收到
芙***y,颜色分类:38 深褐色;尺码:160/84A/M,2021-02-05 13:13:27,好看亲肤，就是有点薄
5***7,颜色分类:38 深褐色;尺码:165/92A/XL,2021-02-05 12:42:50,柔软宽松 买大了
白***燕,颜色分类:09 黑色;尺码:160/84A/M,2021-02-05 11:00:04,很好。之前买了白色。薄薄的很好穿。
法***4,颜色分类:11 粉红色;尺码:160/84A/M,2021-02-05 10:24:42,物流快，物美价廉
