displayUserNick,auctionSku,rateDate,rateContent
w***4,颜色分类:69 藏青色;尺码:165/92A/XL,2021-02-26 18:57:36,很好！！！！
晨***0,颜色分类:01 乳白色;尺码:170/100B/XXL,2021-02-26 18:04:34,整体评价：大小尺码合适，穿着很舒服，发货快
t***2,颜色分类:01 乳白色;尺码:160/84A/M,2021-02-26 08:16:34,质量挺好的，穿着舒服
开***式,颜色分类:42 浅黄色;尺码:160/88A/L,2021-02-25 17:28:16,旗舰店服务确实不咋滴，但是衣服穿着挺好。170/120供参考
c***2,颜色分类:42 浅黄色;尺码:160/84A/M,2021-02-25 11:41:02,颜色好看，面料舒服
t***5,颜色分类:42 浅黄色;尺码:150/76A/XS,2021-02-24 20:59:39,质量很好摸起来很舒服(๑&bull; . &bull;๑)版型一致 就是穿起来有点像阿姨&hellip;（？ 以及购物车里一件优衣库衣服刚放进去没多久忽然降价了50元 我就挺懵 就怕自己这件刚买转身就降价50那我心态也是炸了 总之还是好评啦～
喀***象,颜色分类:01 乳白色;尺码:155/80A/S,2021-02-24 16:23:23,乳白色稍偏黄，版型很好。尺码参考：168/53 S 合身
张***8,颜色分类:42 浅黄色;尺码:150/76A/XS,2021-02-23 20:16:26,建议按平时码买，买小了会太短。
宝***8,颜色分类:01 乳白色;尺码:160/88A/L,2021-02-23 19:26:08,不愧是大牌，值得拥有。
小***5,颜色分类:42 浅黄色;尺码:155/80A/S,2021-02-23 19:20:49,推荐买 上身效果舒服
最***七,颜色分类:01 乳白色;尺码:160/84A/M,2021-02-23 18:52:56,有点黄
千***4,颜色分类:64 湖蓝色;尺码:160/84A/M,2021-02-23 15:23:31,面料舒服 ，无色差，款式大方优雅，爱咯🥰🥰
t***1,颜色分类:69 藏青色;尺码:160/88A/L,2021-02-23 10:55:49,非常好妈妈两个颜色都喜欢
t***1,颜色分类:64 湖蓝色;尺码:160/88A/L,2021-02-23 10:55:49,非常好，妈妈两个颜色都喜欢
冰***6,颜色分类:42 浅黄色;尺码:160/88A/L,2021-02-22 19:48:34,好看！美中不足就是容易皱
猪***8,颜色分类:01 乳白色;尺码:165/92A/XL,2021-02-22 19:42:54,给妈妈买的，妈妈很喜欢，我也很开心
哈***次,颜色分类:42 浅黄色;尺码:165/92A/XL,2021-02-22 14:07:06,和实体店的一样，料子舒服，简单大方
喜***菲,颜色分类:01 乳白色;尺码:155/80A/S,2021-02-22 13:18:41,超级温柔的颜色，太太太适合春天了，面料也非常舒服，就是有点透，需要穿打底或者肉色内衣
n***n,颜色分类:64 湖蓝色;尺码:160/84A/M,2021-02-21 22:10:30,好评
j***n,颜色分类:42 浅黄色;尺码:150/76A/XS,2021-02-21 14:45:29,优衣库老粉
d***r,颜色分类:01 乳白色;尺码:160/84A/M,2021-02-21 09:13:09,休闲
t***1,颜色分类:42 浅黄色;尺码:150/76A/XS,2021-02-20 21:36:42,直接上图。这是店里试的s，有点大，网店买的xs，完美！
保***5,颜色分类:01 乳白色;尺码:160/84A/M,2021-02-20 15:15:49,很温柔的颜色
t***4,颜色分类:42 浅黄色;尺码:160/84A/M,2021-02-19 12:03:22,满意，很好看，面料很好
小***x,颜色分类:01 乳白色;尺码:150/76A/XS,2021-02-16 23:24:58,有线头，不甩干洗后容易皱，
诗***5,颜色分类:01 乳白色;尺码:155/80A/S,2021-02-16 17:04:39,整体评价：宽松 尺码推荐：163/48梨形身材穿s 厚薄度：薄 面料品质：超好，不变形，色彩温柔，近奶油色 上身效果：深米色裙很搭
野***1,颜色分类:42 浅黄色;尺码:155/80A/S,2021-02-16 11:49:30,很舒适 应该买大一号 图一颜色更符合
吃***儿,颜色分类:01 乳白色;尺码:160/84A/M,2021-02-14 13:34:08,整体评价：淘宝清空购物车中到的衣服哈哈哈哈！但如果是花钱买我会觉得性价比不高，不推荐黄皮购买这个乳白色（我觉得这个色带奶油黄）显黑且气色不好。只能化妆穿，所以不是很日常。 尺码推荐：172cm52kg拍M略宽松，长度也合适，七分袖适合初夏穿还算不错 厚薄度：很薄，很容易皱，应该需要每次都熨烫，要不然就皱巴巴不好看 面料品质：棉麻一样的面料，但有点透，需要肉色内衣或者穿吊带打底
e***夕,颜色分类:42 浅黄色;尺码:155/80A/S,2021-02-11 00:33:10,很好看
果***h,颜色分类:42 浅黄色;尺码:160/84A/M,2021-02-09 11:45:04,挺好的，就是洗过后皱，要烫了才穿得。以为洗过后会平整，并不是，可能直接水里捞起不扭它会好一点。我是洗了以后烫过的样子
x***6,颜色分类:42 浅黄色;尺码:150/76A/XS,2021-02-07 14:34:50,整体评价：爱*这个颜色了，不过棉麻的，洗了后缩水，而且好皱。
王***6,颜色分类:42 浅黄色;尺码:175/108C/XXXL,2021-02-07 14:09:18,颜色很好看，特意买了大一些的穿起来更舒服，非常喜欢！
樊***驼,颜色分类:01 乳白色;尺码:155/80A/S,2021-02-07 11:06:30,很棒的啊！我在优衣库买了一身穿起来我觉得很好看！而且服务也好。
h***2,颜色分类:01 乳白色;尺码:155/80A/S,2021-02-06 21:45:19,很休闲，但是有点透
光***央,颜色分类:01 乳白色;尺码:160/88A/L,2021-02-06 20:25:50,很好
光***央,颜色分类:64 湖蓝色;尺码:160/88A/L,2021-02-06 20:25:50,很好
l***n,颜色分类:42 浅黄色;尺码:155/80A/S,2021-02-05 13:30:00,非常好看，显得很温柔，颜色也不错，很适合春夏
w***禾,颜色分类:01 乳白色;尺码:175/108C/XXXL,2021-02-05 08:29:39,喜欢，买了两个颜色
b***7,颜色分类:01 乳白色;尺码:160/84A/M,2021-02-04 23:47:22,好
q***y,颜色分类:01 乳白色;尺码:160/88A/L,2021-02-03 18:21:00,此用户没有填写评论!
m***敌,颜色分类:42 浅黄色;尺码:160/88A/L,2021-02-03 15:49:59,好评
t***1,颜色分类:01 乳白色;尺码:155/80A/S,2021-02-03 13:21:51,还可以，有点麻的感觉。
苦***子,颜色分类:01 乳白色;尺码:165/92A/XL,2021-02-03 12:03:21,面料很舒服，清清爽爽的一件小衬衫，很喜欢！
我***i,颜色分类:42 浅黄色;尺码:155/80A/S,2021-02-03 04:12:22,都很好呀，喜欢优衣库
阳***田,颜色分类:01 乳白色;尺码:150/76A/XS,2021-02-02 20:05:30,漂亮，舒适，很温馨的颜色。
黄***u,颜色分类:01 乳白色;尺码:150/76A/XS,2021-02-01 22:49:34,原价买贵了应该等降价入
t***4,颜色分类:64 湖蓝色;尺码:150/76A/XS,2021-02-01 22:04:32,此用户没有填写评论!
b***1,颜色分类:42 浅黄色;尺码:150/76A/XS,2021-02-01 20:24:13,黄色很好看，身上太宽松
x***n,颜色分类:64 湖蓝色;尺码:155/80A/S,2021-01-27 14:16:27,好
t***8,颜色分类:01 乳白色;尺码:155/80A/S,2021-01-26 17:44:14,还不错，值得入手
嘉***咪,颜色分类:42 浅黄色;尺码:170/100B/XXL,2021-01-25 08:10:28,颜色很好看，不知上身效果怎样，面料手感舒服
买***号,颜色分类:01 乳白色;尺码:160/88A/L,2021-01-21 20:48:33,此用户没有填写评论!
l***u,颜色分类:01 乳白色;尺码:155/80A/S,2021-01-21 17:56:56,这件衬衫七分袖应该是抬起胳膊算的，正常穿着基本算长袖。面料含麻，但还不是全麻的，手感比较细腻，有点顺滑的料子。穿浅色内衣不透，颜色偏米白色吧。不是纯白的感觉。基础百搭款，还不错。
z***8,颜色分类:64 湖蓝色;尺码:155/80A/S,2021-01-20 17:15:49,好慷慨解囊
t***2,颜色分类:01 乳白色;尺码:150/76A/XS,2021-01-20 14:48:48,质感很好，小个子也可以穿
现***馆,颜色分类:01 乳白色;尺码:150/76A/XS,2021-01-20 14:35:07,还可以，店里试了下单的
君***娃,颜色分类:42 浅黄色;尺码:150/76A/XS,2021-01-19 23:25:00,款式和颜色很喜欢，会继续关注的
毛***福,颜色分类:01 乳白色;尺码:165/92A/XL,2021-01-17 21:44:48,穿着很舒服，很好看的衣服，这下很担心另外两件，我拍大了一号。
我***3,颜色分类:01 乳白色;尺码:160/84A/M,2021-01-16 00:07:14,洗了不仅缩水，还很容易皱
z***9,颜色分类:01 乳白色;尺码:160/84A/M,2021-01-12 16:40:05,好
马***音,颜色分类:42 浅黄色;尺码:150/76A/XS,2021-01-11 17:47:18,黄色好看，是很宽松的版型
如***风,颜色分类:01 乳白色;尺码:155/80A/S,2021-01-04 08:19:19,柔软舒适，物美价廉
t***9,颜色分类:69 藏青色;尺码:160/88A/L,2021-01-01 18:41:17,好看 舒适透气
陈***9,颜色分类:42 浅黄色;尺码:165/92A/XL,2020-12-31 09:10:00,好看
余***5,颜色分类:64 湖蓝色;尺码:170/100B/XXL,2020-12-26 20:58:58,看图这颜色不对眼，可是在实体店一眼就相中。果然没有让我失望，非常喜欢
